46,,,,249.0,683438907,1499267509.0,1493931103,269460,682679859.0,,PRJEB13142,SAMEA3905792,https://www.ncbi.nlm.nih.gov/biosample/8788968,Generic,Generic.1.0,8788968.0,2012,,"Sat, 27 Apr 2019 01:03:35 -0000",SRA,5285717,,,2023830397.0,,,,,miscellaneous natural or artificial environment,,,,ERX1424615,https://www.ncbi.nlm.nih.gov/sra/5285717,Illumina HiSeq 2500 paired end sequencing,,0.0,USA,,3552757.0,Illumina HiSeq 2500,metagenome,,,33.284444,paired,,,8743648.0,,metagenomic,WGS,-116.133889,33.2844,-116.134,"Wed, 21 Mar 2018 00:00:00 -0000",miscellaneous,metagenome,1.0,MIMS,1.0,illumina,256318.0,,1.0,,,Max Planck Institute for Chemistry,,Desert varnish metagenome,,,ERR1353140,,"{""INSDC last update"": ""2016-10-21T09:43:31Z"", ""miscellaneous environmental package"": ""miscellaneous natural or artificial environment"", ""Title"": ""DV sample: AB2 3"", ""collection_date"": ""2012"", ""SRA accession"": ""ERS1092926"", ""project_name"": ""Desert varnish metagenome"", ""sample_name"": ""ERS1092926"", ""env_local_scale"": ""rock"", ""geographic location (latitude)"": ""33.284444"", ""env_medium"": ""rock"", ""INSDC center alias"": ""Max Planck Institute for Chemistry"", ""Alias"": ""2"", ""INSDC status"": ""public"", ""sequencing method"": ""Illumina"", ""geo_loc_name"": ""USA"", ""ENA checklist"": ""ERC000025"", ""env_broad_scale"": ""desert"", ""INSDC center name"": ""Max Planck Institute for Chemistry"", ""investigation_type"": ""metagenome"", ""INSDC first public"": ""2018-03-21T17:04:09Z"", ""geographic location (longitude)"": ""-116.133889""}",,ERS1092926,2,,Illumina,,,"Our study provides an insight into the microbial community structure associated with desert varnish, a coating found on exposed rock surfaces in arid environments. We characterize samples from the Colorado Desert, California, USA using whole-genome shotgut sequencing with a special focus on manganese-oxidizing species.","{""ENA-FIRST-PUBLIC"": ""2018-03-21"", ""ENA-LAST-UPDATE"": ""2016-04-04""}",ERP014680,,Desert varnish metagenome,Other,,ERA600938,,,,,metagenome,,4359586838.0,/dataset/3552757
47,,,,150.0,517899582,672924035.0,671552137,292855,519021791.0,,PRJEB15706,SAMEA4497179,https://www.ncbi.nlm.nih.gov/biosample/7224756,Generic,Generic.1.0,7224756.0,2015-11,,"Sat, 05 Aug 2017 14:52:52 -0000",SRA,4165047,0.01,,936643449.0,0,Microbial Mat Material,Beach,soil,microbial mat/biofilm,,,,ERX1809317,https://www.ncbi.nlm.nih.gov/sra/4165047,Illumina HiSeq 2500 paired end sequencing,,0.0,Netherlands,,1987929.0,Illumina HiSeq 2500,metagenome,,,53.489606,paired,,,7938968.0,RANDOM,metagenomic,WGS,6.139913,53.4896,6.1399099999999995,"Fri, 07 Jul 2017 00:00:00 -0000",microbial mat/biofilm,metagenome,1.0,MIMS,1.0,illumina,256318.0,,1.0,,,Royal Netherlands Institute for Sea Research,,Minimal Mat,,,ERR1739691,,"{""unknown"": ""shell width"", ""env_feature"": ""Beach"", ""project_name"": ""Minimal Mat"", ""geographic location (country and/or sea)"": ""Netherlands"", ""geographic location (depth)"": ""0"", ""collection_date"": ""2015-11"", ""samp_store_dur"": ""10"", ""microbial mat/biofilm environmental package"": ""microbial mat/biofilm"", ""env_biome"": ""Microbial Mat Material"", ""longitude"": ""6.139913"", ""env_material"": ""soil"", ""depth"": ""0.01"", ""sequencing method"": ""illumina PE100"", ""sample_name"": ""ERS1396358"", ""latitude"": ""53.489606"", ""samp_store_temp"": ""20"", ""investigation_type"": ""metagenome"", ""geographic location (elevation)"": ""0""}","artificial minimal coastal microbial mats at dilution 0, replicate 1",ERS1396358,MM1_1; artificial minimal coastal microbial mats,,illumina PE100,,,"Minimal coastal microbial mats were created with diluted coastal mat samples obtained from the Dutch barrier island of Schiermonnikoog. The MM's were inoculated in fresh sterilized sand in glass containers contained in a MicroBox. The MicroBox has a transparent lid (allowing photosynthetic growth) and a gas exchange filter. The MM's are propagated under laboratory conditions at a 16h light / 8h dark regime and at a constant 23 C. Serial dilutions used for this data-set are 0, 3 and 5-fold.","{""ENA-FIRST-PUBLIC"": ""2017-06-08"", ""ENA-LAST-UPDATE"": ""2016-11-23""}",ERP017539,,construction of minimal coastal microbial mats,Other,,ERA767571,,,,,metagenome,,2381690400.0,/dataset/1987929
48,,,,101.0,1222742837,870812319.0,860163868,1709572,1219876256.0,,PRJNA256007,SAMN02935331,https://www.ncbi.nlm.nih.gov/biosample/2935331,"MIMS.me, MIGS/MIMS/MIMARKS.built",MIMS.me.built.4.0,2935331.0,,,"Sun, 09 Jul 2017 13:24:52 -0000",SRA,957087,,,2878424400.0,,,,,,,,,SRX684156,https://www.ncbi.nlm.nih.gov/sra/957087,DSN Round 3 Rep 3,,0.0,,,1444401.0,Illumina HiSeq 2500,,,,,paired,,,20669826.0,RANDOM,metagenomic,WGS,,,,"Thu, 24 Jul 2014 12:49:26 -0000",built environment,metagenome,1.0,MIMS,1.0,illumina,1306155.0,,1.0,,"Paul Maclean, paul.h.maclean@gmail.com",AgResearch NZ Ltd,,,,,SRR1577782,,"{""rel_air_humidity"": ""not applicable"", ""organism_count"": ""not applicable"", ""abs_air_humidity"": ""not applicable"", ""lat_lon"": ""not applicable"", ""env_feature"": ""not applicable"", ""heat_cool_type"": ""not applicable"", ""collection_date"": ""not applicable"", ""space_typ_state"": ""not applicable"", ""ventilation_type"": ""not applicable"", ""env_biome"": ""not applicable"", ""geo_loc_name"": ""not applicable"", ""building_setting"": ""not applicable"", ""typ_occupant_dens"": ""not applicable"", ""samp_size"": ""1794891870"", ""description"": ""DSN Round 3 Rep 3"", ""indoor_space"": ""not applicable"", ""filter_type"": ""not applicable"", ""env_material"": ""not applicable"", ""occup_samp"": ""not applicable"", ""build_occup_type"": ""not applicable"", ""air_temp"": ""not applicable"", ""carb_dioxide"": ""not applicable"", ""occupant_dens_samp"": ""not applicable"", ""light_type"": ""not applicable""}",DSN Round 5 Rep 3,SRS687326,DSN Round 3 Rep 3,,illumina,,,Synthetic Metagenome,,SRP045643,,"Synthetic Metagenome. Defined molar ratio of 1,000:100:10:10:1 for Escherichia coli E2348/69:Butyrivibrio proteoclasticus B316T:Prevotella ruminicola 23:E. coli REL606:Lactococcus lactis IL1403. Verious stages of normalisation via DSN and HAP normali",Other,,SRA179880,,,,,mixed culture,,4175304852.0,/dataset/1444401
49,,,,91.0,32086130,40970014.0,31572188,100,39481989.0,,PRJNA354235,SAMN06165520,https://www.ncbi.nlm.nih.gov/biosample/6165520,"MIMS.me, MIGS/MIMS/MIMARKS.human-gut",MIMS.me.human-gut.4.0,6165520.0,2012,,"Sun, 09 Jul 2017 16:03:13 -0000",SRA,3596046,,,101184704.0,,ENVO:00009003,ENVO:2100002,ENVO:00002003,,,,"Participants deposited each bowel movement into a plastic commode collection bowl, and then using a specially designed spoon attached to a collection tube cap, feces were scooped along with into a tube containing RNAlater (PMID24843156). At each time point, participants stored the specimen in the RNAlater fixative at ambient temperature until the specimen collected from the second bowel movement was produced. Each set of stool specimens were then placed in a special mailing kit and returned at ambient temperatures by overnight mail.  Upon receipt, the collection tubes were immediately placed into -80 degrees C freezers.  Nucleic acids were extracted as detailed in this publication PMID24843156.",SRX2481109,https://www.ncbi.nlm.nih.gov/sra/3596046,WGS of metagenomic and metatranscriptomic sequencing of the human gut microbiome: Subject 18754574,,0.0,USA,,1485859.0,Illumina HiSeq 2000,,,,,paired,,18754574_SF06.rna,1575450.0,RANDOM,metagenomic,WGS,,,,"Mon, 19 Dec 2016 13:06:03 -0000",human-gut,metagenome,1.0,MIMS,1.0,illumina,408170.0,,1.0,"Biostatistics, Harvard T.H. Chan School of Public Health, 677 Huntington Ave, Boston, MA , USA","Bahar Sayoldin, sayoldin@hsph.harvard.edu",Harvard T.H. Chan School of Public Health,,,,,SRR5164026,,"{""nucleic_acid"": ""rna"", ""env_feature"": ""ENVO:2100002"", ""sample_timepoint"": ""SF06"", ""env_biome"": ""ENVO:00009003"", ""env_material"": ""ENVO:00002003"", ""collection_date"": ""2012"", ""host"": ""Homo sapiens"", ""host_subject_id"": ""18754574"", ""geo_loc_name"": ""USA"", ""lat_lon"": ""Missing""}",Keywords: GSC:MIxS;MIMS:4.0,SRS1912723,18754574_SF06.rna,,illumina,,Homo sapiens,"We conducted metagenomic and metatranscriptomic sequencing of the human gut microbiome among 308 participants enrolled in a subcohort of men nested within the Health Professionals Follow-up Study. Using a previously validated self-sampling stool collection method (PMID24843156), participants provided up to four stool samples – one set of samples collected approximately 48 hours apart followed by a second set approximately 6 months later. DNA extracted from 929 stool samples and RNA extracted from 378 stool samples was reverse-transcribed to cDNA and sequenced using the Illumina HiSeq platform. Raw data were filtered to remove low quality and human reads. Metagenomic and metatranscriptomic read data were then profiled for functional and taxonomic composition using the HUMAnN2 and MetaPhlAn2 platforms respectively.",,SRP096283,,Human gut metagenome and metatranscriptome raw sequence reads.,Other,,SRA525954,,,,,human gut metagenome,,144110421.0,/dataset/1485859
50,,,,108.0,250529896,181837016.0,181943800,204841,249484447.0,,PRJEB7866,SAMEA3143271,https://www.ncbi.nlm.nih.gov/biosample/3314489,Generic,Generic.1.0,3314489.0,2013-09-14,,"Sat, 05 Aug 2017 08:20:00 -0000",SRA,1210652,1530,,551720179.0,,marine,hydrothermal vent,diffuse fluid,water,,,paired-end and overlapping,ERX639138,https://www.ncbi.nlm.nih.gov/sra/1210652,Illumina HiSeq 1000 paired end sequencing,,0.0,Pacific Ocean,,1948036.0,Illumina HiSeq 1000,metagenome,,,45.943716,paired,,FS898_N3Area_DNA,4000000.0,RANDOM,metagenomic,WGS,-129.985163,45.9437,-129.985,"Fri, 21 Oct 2016 00:00:00 -0000",water,metagenome,1.0,MIMS,1.0,illumina,256318.0,,1.0,,,MBL,,2013 'Omics from the diffuse hydrothermal vents of Axial Seamount,,,ERR694158,,"{""env_feature"": ""hydrothermal vent"", ""project_name"": ""2013 'Omics from the diffuse hydrothermal vents of Axial Seamount"", ""geographic location (country and/or sea)"": ""Pacific Ocean"", ""geographic location (depth)"": ""1530"", ""collection_date"": ""2013-09-14"", ""water environmental package"": ""water"", ""env_biome"": ""marine"", ""longitude"": ""-129.985163"", ""env_material"": ""diffuse fluid"", ""sequencing method"": ""Illumina paired-end, overlapping"", ""sample_name"": ""ERS614331"", ""latitude"": ""45.943716"", ""investigation_type"": ""metagenome""}",,ERS614331,FS898_N3Area_DNA; Metagenomes and metatranscriptomes from the diffuse hydrothermal vents of Axial Seamount from 2013,,"Illumina paired-end, overlapping",,,"This projects explores the functional diversity and activity of rocky subseafloor microbial communities in hydrothermal vent systems. Samples were collected in 2013 from a number of low temperature diffuse fluid vents at Axial seamount, located in the northeast Pacific Ocean. Shotgun metagenomics and metatranscriptomics were performed on four diffuse vent samples.  Previous work at this site determined the taxonomic structure and distribution of microbial communities in venting fluids, but the contribution and mechanisms of the different redox driven metabolisms and the impact these reactions have on vent chemical signatures have not been fully characterized. This study helps to determine the genetic potential and expression patterns of the largely uncharacterized subseafloor microbial community and shows how these patterns change across the complicated biogeochemical gradients of hydrothermal vent systems.",,ERP008851,,Metagenomes and metatranscriptomes from the diffuse hydrothermal vents of Axial Seamount from 2013,Other,,ERA392462,,,,,metagenome,,864000000.0,/dataset/1948036
52,,,,151.0,8758589882,12452648792.0,12694567955,60531231,8429854526.0,,PRJEB10725,SAMEA3539301,https://www.ncbi.nlm.nih.gov/biosample/4352292,Generic,Generic.1.0,4352292.0,2010-05,,"Sun, 06 Aug 2017 10:52:35 -0000",SRA,2170224,0.15,,28181958132.0,455.05,tundra,field,soil,soil,,,,ERX1096254,https://www.ncbi.nlm.nih.gov/sra/2170224,Illumina HiSeq 2000 paired end sequencing,,0.0,USA,,2118089.0,Illumina HiSeq 2000,metagenome,,,63.88306,paired,Illumina TruSeq library preparation,AK-C2 Metagenome,140384743.0,size fractionation,metagenomic,WGS,-149.22556,63.8831,-149.226,"Sun, 20 Nov 2016 00:00:00 -0000",soil,metagenome,1.0,MIMS,1.0,illumina,410658.0,,1.0,,,GEORGIA INSTITUTE OF TECHNOLOGY,,Soil warming project,,,ERR1017187,,"{""env_feature"": ""field"", ""project_name"": ""Soil warming project"", ""geographic location (country and/or sea)"": ""USA"", ""collection_date"": ""2010-05"", ""env_biome"": ""tundra"", ""longitude"": ""-149.22556"", ""env_material"": ""soil"", ""store_cond"": ""-80??C"", ""depth"": ""0.15"", ""soil environmental package"": ""soil"", ""annual_season_precpt"": ""378"", ""annual_season_temp"": ""0"", ""sample_name"": ""ERS846450"", ""latitude"": ""63.88306"", ""sequencing method"": ""Illumina HiSeq"", ""investigation_type"": ""metagenome"", ""geographic location (elevation)"": ""455.05""}",This sample represents soil collected in 2010 from CiPEHR study site in Alaska (1 year after beginning of experimentation). It belongs to the control group (no warming) as sample 'AK-C2',ERS846450,"CiPEHR-AK-2010_C2; Sample AK-C2 from CiPEHR, AK",,Illumina HiSeq,,,"How soil microbial communities from different ecosystems contrast with respect to taxonomic and functional composition remains an unresolved question; one that is vital to predict how climate change will affect soil carbon. We employed shotgun metagenome and 16S rRNA gene amplicon sequencing to characterize community composition and metabolic potential at two distinct ecosystems: Alaskan tundra and natural prairie temperate soil in Oklahoma. The abundance of several metabolic functions differed substantially between the two ecosystems, reflecting mostly the physical characteristics, aboveground plant species composition, and nutrient conditions specific to each site. Correspondingly, the ecosystems shared only a minor fraction of their OTUs (<6%), while Alaska communities were an order of magnitude less diverse their Oklahoma counterparts, allowing near-complete coverage by sequencing (~92% breadth). 27 near-complete, high-quality, population genomes were recovered from the Alaska metagenomes, including an acidobacterial population that comprised 0.77-3.14% of the entire microbial community. These genomes represented diverse taxonomic groups and metabolic lifestyles tuned toward sulfur cycling, methanotrophy, and plant-derived carbon oxidation. Several recovered Alaska populations were also present in geographically distant tundra habitats, suggesting that the assembled populations are also highly relevant at regional or even global scales, and provide potential model organisms for future in-situ experimental manipulations.",,ERP012016,,"We employed shotgun metagenome and 16S rDNA gene amplicon sequencing of topsoil samples to robustly compare the taxonomic and functional gene content variability of microbial soil communities between two key soil ecosystems for climate change, a remote Alaskan tundra (melting) permafrost (AK) and a natural prairie temperate soil in Oklahoma (OK).",Other,,ERA485609,,,,,soil metagenome,,42396192386.0,/dataset/2118089
53,,,,44.0,58823788,66791511.0,66588185,2343,57963115.0,,PRJEB14494,SAMEA4374750,https://www.ncbi.nlm.nih.gov/biosample/5557836,Generic,Generic.1.0,5557836.0,2012-02-03,,"Thu, 06 Jul 2017 03:28:50 -0000",SRA,2892793,"1,91",,138263007.0,840,parkland,lake,sediments,sediment,,,,ERX1630854,https://www.ncbi.nlm.nih.gov/sra/2892793,Illumina HiSeq 2500 sequencing,,0.0,Canada,,611169.0,Illumina HiSeq 2500,metagenome,,,55.512251,single,,,5673737.0,RANDOM,metagenomic,WGS,-119.583535,55.5123,-119.584,"Fri, 21 Oct 2016 00:00:00 -0000",sediment,metagenome,1.0,MIMS,1.0,illumina,749907.0,,1.0,,,CENTRE FOR GEOGENETICS,,Ice-Free corridor,,,ERR1560098,,"{""env_feature"": ""lake"", ""project_name"": ""Ice-Free corridor"", ""geographic location (country and/or sea)"": ""Canada"", ""collection_date"": ""2012-02-03"", ""env_biome"": ""parkland"", ""longitude"": ""-119.583535"", ""env_material"": ""sediments"", ""sediment environmental package"": ""sediment"", ""depth"": ""1,91"", ""sequencing method"": ""illumina HiSeq 100 SR"", ""sample_name"": ""ERS1286199"", ""latitude"": ""55.512251"", ""investigation_type"": ""metagenome"", ""geographic location (elevation)"": ""840""}",shotgun metagenomic dataset from lake sediments,ERS1286199,ICF20; Ice-Free corridor,,illumina HiSeq 100 SR,,,"During the Last Glacial Maximum (LGM) continental ice sheets isolated Beringia (northeast Siberia and northwest North America) from unglaciated North America. By ~15-14 thousand years ago (cal. kyr BP), glacial retreat opened a 1,500-km-long corridor between the ice sheets. It remains unclear when plants and animals colonized this corridor and it became biologically viable for human migration. We obtained radiocarbon dates, pollen, macrofossils and metagenomic DNA from lake sediment cores in a bottleneck portion of the corridor. We find evidence of steppe vegetation, bison and mammoth by ~12.6 cal. kyr BP, followed by open forest, with evidence of moose and elk at ~11.5 cal. kyr BP, and boreal forest ~10 cal. kyr BP. Our findings reveal that the first Americans, whether Clovis or earlier groups in unglaciated North America before 12.6 cal. kyr BP, are unlikely to have travelled this route into the Americas. However, later groups may have used this north-south passageway.",,ERP016137,,Postglacial viability and colonization in North America's ice-free corridor,Other,,ERA686396,,,,,sediment metagenome,,250168942.0,/dataset/611169
54,,,,150.0,1052696153,2084851350.0,2078376071,2304935,1045675791.0,,PRJEB11413,SAMEA3611561,https://www.ncbi.nlm.nih.gov/biosample/4993247,Generic,Generic.1.0,4993247.0,2012-09-24,,"Thu, 06 Jul 2017 23:14:53 -0000",SRA,2519985,,,4418026320.0,,Urban,Wastewater Treatment Plant,Activated Sludge,wastewater/sludge,,,,ERX1156140,https://www.ncbi.nlm.nih.gov/sra/2519985,Illumina HiSeq 2000 paired end sequencing,,0.0,Slovenia,,954037.0,Illumina HiSeq 2000,metagenome,,,45.642998,paired,Nextera,K1.PE,20879681.0,RANDOM,metagenomic,WGS,"14,8619463",45.643,,"Thu, 12 May 2016 13:05:15 -0000",wastewater/sludge,metagenome,1.0,MIMS,1.0,illumina,200795.0,,1.0,,,"Department of Biotechnology, Chemistry and Environmental Engineering, Aalborg University",,Ecodesign,,,ERR1076075,"{""24"": 152226378, ""25"": 98119793, ""26"": 67590513, ""27"": 226870678, ""20"": 131937650, ""21"": 18237194, ""22"": 31945948, ""23"": 97784021, ""28"": 37090092, ""29"": 218123677, ""40"": 176120530, ""41"": 122591223, ""2"": 1136796762, ""5"": 35943017, ""7"": 46759746, ""6"": 9014493, ""9"": 3317652, ""8"": 30055232, ""39"": 197191828, ""38"": 167577079, ""11"": 4963562, ""10"": 28324126, ""13"": 16233771, ""12"": 14169642, ""15"": 69846352, ""14"": 5806401, ""17"": 33365876, ""16"": 19552114, ""19"": 30391798, ""18"": 55263026, ""31"": 362097680, ""30"": 222037437, ""37"": 217330681, ""36"": 108757365, ""35"": 853721122, ""34"": 393365354, ""33"": 618942349, ""32"": 204442138}","{""env_feature"": ""Wastewater Treatment Plant"", ""project_name"": ""Ecodesign"", ""geographic location (country and/or sea)"": ""Slovenia"", ""collection_date"": ""2012-09-24"", ""geographic location (longitude)"": ""14,8619463"", ""env_package"": ""wastewater/sludge"", ""env_biome"": ""Urban"", ""investigation_type"": ""metagenome"", ""sequencing method"": ""Illumina"", ""env_material"": ""Activated Sludge"", ""geographic location (latitude)"": ""45.642998""}",,ERS918710,Activated sludge samples taken from Kocejve WWTP on the 24th of september 2012,,Illumina,,,"Overgrowth of filamentous bacteria in activated sludge wastewater treatment plants (WWTPs) leads to impaired sludge settleability, a condition known as bulking, which is a common operational problem worldwide. Filaments with the Eikelboom 0092 morphotype are commonly associated with such bulking episodes. Members of the uncultured B45 phylotype, which is embraced within the phylum Chloroflexi, were recently shown to exhibit this morphology. Although these organisms are among the most abundant populations recorded in activated sludge processes, nothing is known about their metabolic characteristics. In this study, a genome sequence, representing the phylotype, was retrieved from a metagenome generated from an activated sludge WWTP plant. The genome consisted of two chromosomes and one plasmid, which were 4.0, 1.0, and 0.04 Mbps in size, respectively. A metabolic model was constructed for this organism, based on annotation of its genome, showing its ability to generate energy by aerobic respiration, utilizing oxygen, nitrite, or nitrous oxide as electron acceptors, or by fermentation of sugars. This model was validated partially in situ. The provisional name of Candidatus “Promineofilum breve” is proposed for this species. This study represents the first detailed information on an uncultured genus of filamentous organisms from activated sludge.",,ERP012797,"{""PUBMED"": ""26905629""}",Genomic and in situ investigations of the novel uncultured Chloroflexi associated with 0092 morphotype filamentous bulking in activated sludge,Other,,ERA525235,,,,,Chloroflexi,,6263904300.0,/dataset/954037
55,,,,150.0,567467421,362835221.0,364068402,12059,560119697.0,,PRJEB22845,SAMEA104326132,https://www.ncbi.nlm.nih.gov/biosample/9550653,Generic,Generic.1.0,9550653.0,2015-01-09,,"Tue, 23 Apr 2019 15:15:52 -0000",SRA,5842980,,,866497821.0,,,,,plant-associated,,,,ERX2201930,https://www.ncbi.nlm.nih.gov/sra/5842980,Illumina HiSeq 3000 paired end sequencing,,0.0,France,,3278308.0,Illumina HiSeq 3000,metagenome,,,47.4667,paired,,BG12,6181676.0,other,metagenomic,OTHER,-0.55,47.4667,-0.55,"Tue, 22 May 2018 00:00:00 -0000",plant-associated,metagenome,1.0,MIMS,1.0,,404790.0,,1.0,,,INRA Angers,,MetaSeed,,,ERR2145397,,"{""INSDC last update"": ""2017-09-29T15:03:33Z"", ""Title"": ""Seed, germinating seeds and seedlings metagenomes from Brasicca napus and Phaseolus vulgaris"", ""collection_date"": ""2015-01-09"", ""env_local_scale"": ""comercial inoculum"", ""investigation_type"": ""metagenome"", ""geo_loc_name"": ""France"", ""sample_name"": ""ERS1951110"", ""geographic location (latitude)"": ""47.4667"", ""geographic location (longitude)"": ""-0.55"", ""plant-associated environmental package"": ""plant-associated"", ""project_name"": ""MetaSeed"", ""description"": ""In this project, we aim to apply metagenomics approaches to uncover the function of the seed microbiota and its changes during germination and emergence. We will try to reveal through metagenomics the genetic content of this microbiota in seeds, germinating seeds and seedlings from 2 different plant families (Fabaceae and Brassicaceae)."", ""env_medium"": ""comercial inoculum"", ""Alias"": ""MetaSeed1"", ""INSDC status"": ""public"", ""sequencing method"": ""Shotgun Illumina sequencing"", ""env_broad_scale"": ""seed"", ""INSDC first public"": ""2018-05-22T17:03:04Z"", ""SRA accession"": ""ERS1951110"", ""INSDC center alias"": ""INRA Angers"", ""ENA checklist"": ""ERC000020"", ""INSDC center name"": ""INRA Angers""}",,ERS1951110,MetaSeed1,,Shotgun Illumina sequencing,,,"In this project, we aim to apply metagenomics approaches to uncover the function of the seed microbiota and its changes during germination and emergence. We will try to reveal through metagenomics the genetic content of this microbiota in seeds, germinating seeds and seedlings from 2 different plant families (Fabaceae and Brassicaceae). The study of the differences in gene abundance during germination and emergence in these plant species will reveal novel insights regarding the function and colonizing strategies of microorganisms in seeds and young plants.","{""ENA-FIRST-PUBLIC"": ""2018-05-22"", ""ENA-LAST-UPDATE"": ""2017-09-29""}",ERP104558,,Microbial functional diversity and its dynamics during seed germination and emergence,Other,,ERA1106586,,,,,Phaseoleae environmental sample,,1854502800.0,/dataset/3278308
