,age,altitude,assembly,avg_read_length_maxrun,baseA_count_maxrun,baseC_count_maxrun,baseG_count_maxrun,baseN_count_maxrun,baseT_count_maxrun,biomaterial_provider,bioproject_id,biosample_id,biosample_link,biosample_models,biosample_package,biosample_uid,collection_date,collection_time,date_scraped,db_source,db_source_uid,depth,dev_stage,download_size_maxrun,elevation,env_biome,env_feature,env_material,env_package,estimated_size,experimental_factor,expt_design_description,expt_id,expt_link,expt_title,finishing_strategy,gc_percent_maxrun,geo_loc_name,host_disease,id,instrument_model,investigation_type,isol_growth_condt,lat_lon,latitude,library_construction_method,library_construction_protocol,library_name,library_reads_sequenced_maxrun,library_screening_strategy,library_source,library_strategy,longitude,meta_latitude,meta_longitude,metadata_publication_date,metaseek_env_package,metaseek_investigation_type,metaseek_investigation_type_P,metaseek_mixs_specification,metaseek_mixs_specification_P,metaseek_sequencing_method,ncbi_taxon_id,num_replicons,num_runs_in_accession,organization_address,organization_contacts,organization_name,ploidy,project_name,propagation,ref_biomaterial,run_ids_maxrun,run_quality_counts_maxrun,sample_attributes,sample_description,sample_id,sample_title,sample_type,sequencing_method,sex,specific_host,study_abstract,study_attributes,study_id,study_links,study_title,study_type,study_type_other,submission_id,subspecific_genetic_lineage,target_gene,target_subfragment,taxon_common_name,taxon_scientific_name,tissue,total_num_bases_maxrun,uri
0,,,,97.0,9936406815,11142307193.0,11037984069,191833,9887895529.0,,PRJEB4352,SAMEA2732425,https://www.ncbi.nlm.nih.gov/biosample/6020890,Generic,Generic.1.0,6020890.0,,,"Sun, 09 Jul 2017 04:33:44 -0000",SRA,3430594,5,,28899686257.0,,marine biome (ENVO:00000447),surface water layer (ENVO:00002042),"particulate matter, including plankton (ENVO:xxxxxxxx)",water,,,,ERX1796699,https://www.ncbi.nlm.nih.gov/sra/3430594,Illumina HiSeq 2000 paired end sequencing; environmental samples,,0.0,,,1304153.0,Illumina HiSeq 2000,,,,,paired,Metagenomic WGS library preparation,AHX_BREIOSF_r1,215328685.0,RANDOM,metagenomic,WGS,,,,"Fri, 13 Jan 2017 00:00:00 -0000",water,metagenome,0.947262,MIMS,0.947262,illumina,408172.0,,1.0,,,GSC,,Tara Oceans expedition (2009-2013),,,ERR1726943,"{""24"": 274010718, ""25"": 292003964, ""26"": 276570465, ""27"": 479068385, ""20"": 196542477, ""21"": 51941483, ""22"": 85456977, ""23"": 223071166, ""28"": 176469282, ""29"": 607911039, ""40"": 3735102771, ""41"": 7312067255, ""2"": 191833, ""5"": 33138144, ""7"": 86095463, ""6"": 17300307, ""9"": 16221608, ""8"": 52988678, ""39"": 3643254411, ""38"": 1821008560, ""11"": 17423498, ""10"": 41917991, ""13"": 20344648, ""12"": 30350947, ""15"": 87869522, ""14"": 15032015, ""17"": 63298359, ""16"": 34038691, ""19"": 69750024, ""18"": 117807032, ""31"": 1334461052, ""30"": 764052291, ""37"": 3416713988, ""36"": 1584151622, ""35"": 8570661301, ""34"": 3321580585, ""33"": 2247935542, ""32"": 886981345}","{""Citation"": ""tbd"", ""Longitude End"": ""-101.2403"", ""Sampling Station"": ""TARA_096"", ""Size Fraction Lower Threshold"": ""5"", ""ENA-LAST-UPDATE"": ""2015-11-04"", ""env_feature"": ""surface water layer (ENVO:00002042)"", ""Size Fraction Upper Threshold"": ""20"", ""Salinity Sensor"": ""35.7731"", ""Sample Collection Device"": ""PLANKTON NET, TYPE=Single, MESH_Size_(???m)=5, MOUTH_Opening_(m^2)=0.196349, LENGTH_(m)=2.5"", ""env_biome"": ""marine biome (ENVO:00000447)"", ""Further Details"": ""tbd"", ""Oxygen Sensor"": ""204.58"", ""Longitude Start"": ""-101.2351"", ""Event Date/Time Start"": ""2011-03-24T16:07"", ""project_name"": ""Tara Oceans expedition (2009-2013)"", ""Sample Status"": ""This version can be used to provide data discovery services"", ""Event Label"": ""TARA_20110324T1607Z_096_EVENT_NET"", ""Latitude Start"": ""-29.6597"", ""sample_name"": ""ERS491553"", ""Last Update Date"": ""2014-05-01Z"", ""env_material"": ""particulate matter, including plankton (ENVO:xxxxxxxx)"", ""Sampling Platform"": ""SV Tara"", ""ENA-FIRST-PUBLIC"": ""2016-11-14"", ""Event Date/Time End"": ""2011-03-24T16:17"", ""Sampling Campaign"": ""TARA_20110311Z"", ""Chlorophyll Sensor"": ""0.006724"", ""temp"": ""23.807833"", ""env_package"": ""water"", ""Protocol Label"": ""PROT_NUC-DNA(1L)_N5-20"", ""depth"": ""5"", ""Latitude End"": ""-29.6559"", ""Nitrate Sensor"": ""0.104903""}","This sample (TARA_N000001258) was collected during the Tara Oceans expedition (2009-2013) at station TARA_096 (latitudeN=-29.6597, longitudeE=-101.2351) on date/time=2011-03-24T16:07, using a PLANKTON NET, TYPE=Single, MESH_Size_(???m)=5, MOUTH_Opening_(m^2)=0.196349, LENGTH_(m)=2.5. The sample material (particulate matter, including plankton (ENVO:xxxxxxxx)) was collected at a depth of 3-7 m, targeting a surface water layer (ENVO:00002042) in the marine biome (ENVO:00000447). The sample was size-fractionated (5-20 micrometres), and stored in liquid nitrogen for later detection of unicellular eukaryote (protist) nucleic acid sequences by pyrosequencing methods, and for later metagenomics analysis. This sample has replicate sample(s): TARA_N000001259.",ERS491553,TARA_N000001258; TARA_20110324T1607Z_096_EVENT_NET_N1_S_(5 m)_PROT_NUC-DNA(1L)_N5-20_TARA_N000001258,,illumina,,,Seawater was filtered from different depths to retain small and large cell sizes. The DNA was extracted and submitted to high throughput sequencing.,,ERP003628,,Shotgun Sequencing of Tara Oceans DNA samples corresponding to size fractions for protist,Metagenomics,,ERA763626,,,,,marine metagenome,,42004785439.0,/dataset/1304153
1,,,,93.0,9406405292,8301601551.0,8287524401,64590,9425793270.0,,PRJEB23561,SAMEA104395223,https://www.ncbi.nlm.nih.gov/biosample/8400405,Generic,Generic.1.0,8400405.0,2012-08-07,,"Fri, 17 May 2019 15:44:26 -0000",SRA,5168992,,,24914353296.0,,,,,host-associated,,,,ERX2255662,https://www.ncbi.nlm.nih.gov/sra/5168992,Illumina HiSeq 2000 paired end sequencing,,0.0,France,,5690979.0,Illumina HiSeq 2000,metagenome,,,45.71,paired,,,189422998.0,other,metagenomic,WGS,3.01,45.71,3.01,"Sun, 21 Jan 2018 00:00:00 -0000",host-associated,metagenome,1.0,MIMS,1.0,illumina,1218275.0,,1.0,,,BGI,,Rumen metagenome,,,ERR2200674,,"{""INSDC last update"": ""2017-11-22T08:59:21Z"", ""Title"": ""An.583 rumen microbiome"", ""collection_date"": ""2012-08-07"", ""env_local_scale"": ""rumen"", ""investigation_type"": ""metagenome"", ""geo_loc_name"": ""France"", ""sample_name"": ""ERS2013165"", ""geographic location (latitude)"": ""45.71"", ""geographic location (longitude)"": ""3.01"", ""project_name"": ""Rumen metagenome"", ""description"": ""eukaryote-depleted rumen microbiota"", ""env_medium"": ""rumen"", ""Alias"": ""An.583"", ""INSDC status"": ""public"", ""sequencing method"": ""Illumina"", ""env_broad_scale"": ""rumen"", ""INSDC first public"": ""2018-01-21T17:03:26Z"", ""host-associated environmental package"": ""host-associated"", ""SRA accession"": ""ERS2013165"", ""INSDC center alias"": ""BGI"", ""ENA checklist"": ""ERC000013"", ""INSDC center name"": ""Beijing Genome Institute""}",,ERS2013165,An.583,,Illumina,,,"The rumen microbiome is responsible for the unique nature of ruminants. A thorough knowledge of the genetic potential of rumen symbiotic microbes is therefore crucial for the sustainability of ruminant production systems. Using deep metagenome sequencing we identified 13,825,880 non-redundant prokaryote genes from the bovine rumen and constructed 324 high quality metagenomic species. These metagenomic species were prevalent in the rumen of 77 cattle fed various diets whereas known rumen microbial genomes were less abundant. Compared to human, pig and mouse gut metagenome catalogs, the rumen is richer in functions and microbial species associated to the degradation of lignocellulosic material and production of methane. Genes coding for enzymes that deconstruct lignocellulosic substrates showed a particularly high richness that is otherwise impossible to infer from available genomes or shallow metagenomics sequencing. These data bring new insights on functions, enzymes and microbes of the rumen, critical to understand phenotypes and biological processes.","{""ENA-FIRST-PUBLIC"": ""2018-02-27"", ""ENA-LAST-UPDATE"": ""2017-11-22""}",ERP105320,,A catalog of microbial genes from the bovine rumen reveals the determinants of herbivory,Other,,ERA1138909,,,,,bovine metagenome,,35421389104.0,/dataset/5690979
2,,,,101.0,3444474066,5271387162.0,5303207041,1644344,3436626125.0,,PRJEB20765,SAMEA104055715,https://www.ncbi.nlm.nih.gov/biosample/7337500,Generic,Generic.1.0,7337500.0,2011-09,,"Wed, 15 May 2019 05:24:01 -0000",SRA,5163800,0-0.5,,12203350826.0,0,,,,soil,,,,ERX2023408,https://www.ncbi.nlm.nih.gov/sra/5163800,Illumina HiSeq 2000 sequencing,,0.0,USA,,5521303.0,Illumina HiSeq 2000,metagenome,,,71.3°N,single,,,172844938.0,size fractionation,metagenomic,WGS,156.5°W,,,"Sat, 08 Jul 2017 00:00:00 -0000",soil,metagenome,1.0,MIMS,1.0,illumina,410658.0,,1.0,,,Ecology Department,,NGEE Arctic Polygons,,,ERR1960504,,"{""INSDC last update"": ""2018-02-21T23:36:03Z"", ""Title"": ""NGEE Arctic Polygons"", ""geographic location (depth)"": ""0-0.5"", ""collection_date"": ""2011-09"", ""env_local_scale"": ""Polygonal ground"", ""investigation_type"": ""metagenome"", ""geo_loc_name"": ""USA"", ""sample_name"": ""ERS1719608"", ""geographic location (latitude)"": ""71.3\u00b0N"", ""project_name"": ""NGEE Arctic Polygons"", ""description"": ""Flat Centered-204-Organic"", ""ENA checklist"": ""ERC000022"", ""env_medium"": ""soil"", ""Alias"": ""Flat Centered-204-Organic"", ""INSDC status"": ""public"", ""sequencing method"": ""Illumina"", ""env_broad_scale"": ""Arctic tundra"", ""INSDC first public"": ""2017-07-08T17:02:53Z"", ""geographic location (longitude)"": ""156.5\u00b0W"", ""INSDC center alias"": ""Ecology Department"", ""soil environmental package"": ""soil"", ""SRA accession"": ""ERS1719608"", ""INSDC center name"": ""Ecology Department"", ""geographic location (elevation)"": ""0""}",,ERS1719608,Flat Centered-204-Organic,,Illumina,,,"Arctic soils contain an estimated 12-42% of the global soil C and much of this carbon is trapped in permafrost. With increasing global temperatures, thawing permafrost is becoming a potential source of greenhouse gas (GHG) emissions. On the Alaskan North Slope the collapse and rise of soil due to formation of ice wedges and permafrost thaw create distinct features called polygons. As part of the U.S. Department of Energy (DOE) Next Generation Ecosystem Experiment (NGEE) in the Arctic, we collected seasonally thawed active layer soils across a transect of polygon features at the Barrow Environmental Observatory (BEO). We used Illumina HiSeq technology to sequence metagenomes. The sequence data was accompanied by GHG flux measurements, geophysical and geochemical soil characteristics.","{""ENA-FIRST-PUBLIC"": ""2018-02-22"", ""ENA-LAST-UPDATE"": ""2019-01-16""}",ERP022944,"{""PUBMED"": ""29472560""}",NGEE Arctic Microbial Communities of Polygonal Grounds,Other,,ERA912527,,,,,soil metagenome,,17457338738.0,/dataset/5521303
3,,,,113.0,109820727,113523893.0,113307807,115606,109620613.0,,PRJNA340165,SAMN05710710,https://www.ncbi.nlm.nih.gov/biosample/5710710,"MIMS.me, MIGS/MIMS/MIMARKS.sediment",MIMS.me.sediment.4.0,5710710.0,02-Sep-2012,,"Mon, 03 Jul 2017 06:34:35 -0000",SRA,3050361,0-2 mbsf,,172824819.0,-9161,marine,ocean trench,sediment,,,,"Metagenomic shotgun sequencing (Hiseq): We use Picogreen (Invitrogen) to quantitate genomic DNA samples. DNA is sheared using a Covaris and libraries were constructed with the Nugen Ovation Ultralow Library protocol. We aim for an insert size of 175bp to enable read merging. Amplified libraries are visualized on an Agilent DNA1000 chip or Caliper HiSens Bioanalyzer assay, pooled at equimolar concentrations based on these results, and size selected using a Sage PippinPrep 2% cassette. The library pool is quantified using a Kapa Biosystems qPCR library quantification kit, then sequenced on the Illumina HiSeq1000 in a 2x100 paired-end sequencing run using dedicated read indexing. The samples are demultiplexed with CASAVA 1.8.2.",SRX2056175,https://www.ncbi.nlm.nih.gov/sra/3050361,HiSeq WGSTonga trench sediment core,,0.5082800000000001,Pacific Ocean,,231812.0,Illumina HiSeq 1000,,,16.641750 S 172.200017 W,,paired,,60_70_HS,1975171.0,RANDOM,metagenomic,WGS,,-16.6418,-172.2,"Fri, 26 Aug 2016 09:28:04 -0000",sediment,metagenome,1.0,MIMS,1.0,illumina,412755.0,,1.0,"JBPC, Marine Biological Laboratory, 7 MBL Street, Woods Hole, MA, United States of America","Hilary Morrison, morrison@mbl.edu",Marine Biological Laboratory,,,,,SRR4069407,,"{""env_feature"": ""ocean trench"", ""geo_loc_name"": ""Pacific Ocean"", ""collection_date"": ""02-Sep-2012"", ""env_biome"": ""marine"", ""label"": ""60_70"", ""depth"": ""0-2 mbsf"", ""other"": ""Two meters of sediments were collected via gravity core"", ""elev"": ""-9161"", ""env_material"": ""sediment"", ""lat_lon"": ""16.641750 S 172.200017 W""}",Keywords: GSC:MIxS;MIMS:4.0,SRS1648185,MIMS Environmental/Metagenome sample from marine sediment metagenome,,illumina,,,"In this project we will investigate the metagenome of the Tonga Trench, at 9.2km water depth and up to 2 m sediment depth. Species of hadal fauna are restricted to single or adjacent trenches and as a result trenches have been referred to as “zoographic provinces”. Put another way, trenches are biogeographically constrained “inverted islands of biodiversity”. At this time it is not clear how different trench microbial communities are distinct from one another or from those present in bathypelagic and abyssal regions. As trenches are an extremely unique ecosystem from the pelagic environment, we anticipate that sediments from within trenches will be equally unique and organisms from the Tonga Trench will show unique adaptations to their environment, which can be determined from comparative sequence analysis.","{""parent_bioproject"": ""PRJNA183206""}",SRP083067,"{""The Census of Deep Life"": ""http://codl.coas.oregonstate.edu/""}",sediment metagenome Metagenome,Metagenomics,,SRA455700,,,,,marine sediment metagenome,,446388646.0,/dataset/231812
4,,,,251.0,1398353534,1252008436.0,1233811816,146370,1387043794.0,,PRJEB31310,SAMEA5366184,https://www.ncbi.nlm.nih.gov/biosample/11298102,Generic,Generic.1.0,11298102.0,2016-10-17,,"Sun, 19 May 2019 01:28:26 -0000",SRA,7566081,,,3001275819.0,,,,,wastewater/sludge,,,,ERX3201317,https://www.ncbi.nlm.nih.gov/sra/7566081,Illumina HiSeq 2500 paired end sequencing,,0.0,Denmark,,5860492.0,Illumina HiSeq 2500,metagenome,,,55.57524,paired,Illumina Nextera DNA Library Prep,MG-HLP-11,10500725.0,,metagenomic,WGS,9.747566,55.5752,9.74757,"Sun, 31 Mar 2019 00:00:00 -0000",wastewater/sludge,metagenome,1.0,MIMS,1.0,illumina,1263854.0,,1.0,,"Aaron Saunders, ams@bio.aau.dk",Aalborg University,,Novel syntrophic bacteria in full-scale anaerobic digesters revealed by genome-centric metatranscriptomics,,,ERR3173383,,"{""INSDC last update"": ""2019-02-22T09:47:56Z"", ""project_name"": ""Novel syntrophic bacteria in full-scale anaerobic digesters revealed by genome-centric metatranscriptomics"", ""wastewater/sludge environmental package"": ""wastewater/sludge"", ""Title"": ""anaerobic digester metagenome"", ""collection_date"": ""2016-10-17"", ""SRA accession"": ""ERS3172790"", ""sample_name"": ""ERS3172790"", ""env_local_scale"": ""Anaerobic digester"", ""geographic location (latitude)"": ""55.57524"", ""env_medium"": ""Activated sludge"", ""INSDC center alias"": ""AALBORG UNIVERSITY"", ""Alias"": ""HQ171006-6"", ""INSDC status"": ""public"", ""sequencing method"": ""Illumina"", ""geo_loc_name"": ""Denmark"", ""ENA checklist"": ""ERC000023"", ""env_broad_scale"": ""Waste water treatment plant"", ""INSDC center name"": ""AALBORG UNIVERSITY"", ""investigation_type"": ""metagenome"", ""INSDC first public"": ""2019-03-31T17:02:51Z"", ""geographic location (longitude)"": ""9.747566""}",,ERS3172790,HQ171006-6,,Illumina,,,"Short-chain fatty acid (SCFA) degradation is an essential step that occurs across methanogenic environments, and is usually catalyzed by SCFA-oxidizing bacteria in syntrophy with methanogens. Current knowledge of this functional guild is mainly based on isolated or enriched syntrophs due to past methodological limitations. However, it is unclear whether these reference organisms reflect the true ecological properties and in situ activities of the syntrophs that predominate in full-scale systems. Here we describe novel, metabolically versatile bacterial species playing key roles in SCFA oxidation which were ubiquitous in full-scale anaerobic sludge digesters. A genome-guided metatranscriptomic approach was employed, with 198 metagenome-assembled genomes (MAGs) generated from the microbiome of two digesters. The transcriptomic response of individual MAG was studied after stimulation with low concentration of acetate, propionate, or butyrate, to identify the positively responsive members. Such responding MAGs included one bacterium of the family Pelotomaculaceae, and two bacteria of the class Desulfomonilia, which encoded complete propionate or butyrate beta-oxidation pathways that were significantly upregulated under propionate or butyrate stimulation, respectively. These three SCFA oxidizers were detected in most of the 38 investigated digesters, and encoded unique genomic features compared with the well-characterized populations, including the metabolic pathways for phosphite oxidation, nitrite, or sulfate reduction.","{""ENA-FIRST-PUBLIC"": ""2019-03-31"", ""ENA-LAST-UPDATE"": ""2019-02-18""}",ERP113854,,Investigating the response of digester metagenomes to various short-chain fatty acids using genome-centric metatranscriptomics,Other,,ERA1745989,,,,,anaerobic digester metagenome,,5271363950.0,/dataset/5860492
5,,,,101.0,1174503914,1108529955.0,1234409039,177014,1098175018.0,,PRJEB28871,SAMEA4949424,https://www.ncbi.nlm.nih.gov/biosample/10514653,Generic,Generic.1.0,10514653.0,2016-06-23,,"Wed, 08 May 2019 05:55:18 -0000",SRA,6860351,,,2032834901.0,,,,,plant-associated,,,,ERX2826699,https://www.ncbi.nlm.nih.gov/sra/6860351,Illumina HiSeq 2500 paired end sequencing,,0.0,Italy,,5055175.0,Illumina HiSeq 2500,metagenome,,,45.5430306,paired,,,22850470.0,size fractionation,metagenomic,WGS,9.215147222,45.543,9.21515,"Fri, 30 Nov 2018 00:00:00 -0000",plant-associated,metagenome,1.0,MIMS,1.0,,256318.0,,1.0,,,UNIMIB,,SINERGIA,,,ERR2819892,,"{""INSDC last update"": ""2018-10-02T10:10:36Z"", ""Title"": ""Cedar and Magnolia microbiome"", ""collection_date"": ""2016-06-23"", ""env_local_scale"": ""urban park"", ""investigation_type"": ""metagenome"", ""host_taxid"": ""3406"", ""geo_loc_name"": ""Italy"", ""sample_name"": ""ERS2768105"", ""geographic location (latitude)"": ""45.5430306"", ""geographic location (longitude)"": ""9.215147222"", ""plant-associated environmental package"": ""plant-associated"", ""project_name"": ""SINERGIA"", ""description"": ""Magnolia leaf"", ""env_medium"": ""leaf"", ""Alias"": ""MI-giu-M1_meta"", ""host"": ""Magnolia"", ""INSDC status"": ""public"", ""sequencing method"": ""Illumina HiSeq 2512"", ""env_broad_scale"": ""phyllome"", ""INSDC first public"": ""2018-11-30T11:02:55Z"", ""SRA accession"": ""ERS2768105"", ""INSDC center alias"": ""UNIMIB"", ""ENA checklist"": ""ERC000020"", ""INSDC center name"": ""UNIMIB""}",,ERS2768105,MI-giu-M1_meta,,Illumina HiSeq 2512,,Magnolia,"The fundamental aim of the SINERGIA project is to extend the capability of phyllospheric microorganisms for air cleanup. The current proposal is focused on the exploitation of phyllospheric microbiota for improving air quality, in particular in polluted productive sites. The key premise is that phyllospheric microbiota contain a rich and largely unexplored pool of enzymes able to promote an efficient degradation of airborne organic pollutants. This is an innovation- driven research proposal aimed to develop, support and produce a proof-of-concept prototype for bacteria-assisted phylloremediation of air contaminants. In contrast to the current available technologies, this breakthrough prototype has as proposal to offer an eco-friendly, solar-powered, sustainable and inexpensive solution for indoor/outdoor air pollution problems.","{""ENA-FIRST-PUBLIC"": ""2018-11-30"", ""ENA-LAST-UPDATE"": ""2018-10-01""}",ERP111130,,SINERGIA-Phyllosphere bacteria and air pollution,Other,,ERA1614303,,,,,metagenome,,4615794940.0,/dataset/5055175
6,,,,101.0,12733097740,13158281765.0,13193400432,72126767,12651636570.0,,PRJDB4244,SAMD00041427,https://www.ncbi.nlm.nih.gov/biosample/5438647,MIMS.me.miscellaneous,MIMS.me.miscellaneous.4.0,5438647.0,2014,,"Wed, 09 Aug 2017 10:08:33 -0000",SRA,2842583,,,36045552489.0,,,bioreactor,activated sludge,,,,,DRX042106,https://www.ncbi.nlm.nih.gov/sra/2842583,Illumina HiSeq 2000 paired end sequencing of SAMD00041427,,0.0,"Japan:Tokyo, Hachioji",,2428842.0,Illumina HiSeq 2000,,,35.6383 N 139.3851 E,,paired,,MAS_shotgun,256477937.0,RANDOM,metagenomic,WGS,,35.6383,139.385,"Tue, 26 Jul 2016 00:01:58 -0000",miscellaneous,metagenome,1.0,MIMS,1.0,illumina,942017.0,,1.0,,,TOKYO_PHARM,,Analysis of methanol-fed microbiomes,,,DRR046818,,"{""env_feature"": ""bioreactor"", ""project_name"": ""Analysis of methanol-fed microbiomes"", ""collection_date"": ""2014"", ""env_biome"": ""not applicable"", ""env_material"": ""activated sludge"", ""geo_loc_name"": ""Japan:Tokyo, Hachioji"", ""sample_name"": ""0002_MAS"", ""lat_lon"": ""35.6383 N 139.3851 E""}",Keywords: GSC:MIxS;MIMS:4.0,DRS032696,Methanol-acclimatized activated sludge,,illumina,,,"Methanol-fed activated-sludge (MAS) microbiomes were subjected to phylogenetic and metagenomic analyses, and genomic features of dominant methylotrophs in MAS were compared with those preferentially grown in laboratory enrichment cultures.",,DRP003208,,Genomic features of uncultured methylotrophs in activated-sludge microbiomes grown under different enrichment procedures,Other,,DRA004030,,,,,activated sludge metagenome,,51808543274.0,/dataset/2428842
7,,,,147.0,524872391,491938632.0,492473524,0,504902268.0,,PRJEB21574,SAMEA104144116,https://www.ncbi.nlm.nih.gov/biosample/12161465,Generic,Generic.1.0,12161465.0,2016-08,,"Wed, 28 Aug 2019 19:44:16 -0000",SRA,8439904,0,,917591403.0,56,,,,microbial mat/biofilm,,,whole-genome sequencing libraries were generated using the Nextera DNA Library Preparation Kit,ERX2079273,https://www.ncbi.nlm.nih.gov/sra/8439904,NextSeq 500 paired end sequencing,,0.0,Germany,,6331978.0,Illumina NextSeq 500,metagenome,,,52.458569 N,paired,paired,L1_S13,6818338.0,RANDOM,metagenomic,WGS,13.288657 E,52.4586,13.2887,"Thu, 27 Jun 2019 00:00:00 -0000",microbial mat/biofilm,metagenome,1.0,MIMS,1.0,illumina,9823.0,,1.0,,,Freie University of Berlin,,2017_Zinc,,,ERR2020026,,"{""INSDC last update"": ""2017-06-28T15:08:00Z"", ""Title"": ""pig gut metagenome from Weaned pig 13 - Zinc high dose"", ""geographic location (depth)"": ""0"", ""collection_date"": ""2016-08"", ""env_local_scale"": ""barn"", ""investigation_type"": ""metagenome"", ""geo_loc_name"": ""Germany"", ""sample_name"": ""ERS1803134"", ""geographic location (latitude)"": ""52.458569 N"", ""project_name"": ""2017_Zinc"", ""ENA checklist"": ""ERC000019"", ""microbial mat/biofilm environmental package"": ""microbial mat/biofilm"", ""env_medium"": ""stool"", ""Alias"": ""2017_Zinc_S13"", ""INSDC status"": ""public"", ""sequencing method"": ""ILLUMINA NextSeq 500"", ""env_broad_scale"": ""faeces"", ""INSDC first public"": ""2019-06-27T04:02:22Z"", ""geographic location (longitude)"": ""13.288657 E"", ""INSDC center alias"": ""Freie University of Berlin"", ""SRA accession"": ""ERS1803134"", ""INSDC center name"": ""Freie University of Berlin"", ""geographic location (elevation)"": ""56""}",,ERS1803134,2017_Zinc_S13,,ILLUMINA NextSeq 500,,,,"{""ENA-FIRST-PUBLIC"": ""2019-06-27"", ""ENA-LAST-UPDATE"": ""2017-06-28""}",ERP023840,,We studied the effect of different zinc sources on the intestinal microbiome in weaned pigs,Other,,ERA966087,,,,,Sus scrofa,,2014186815.0,/dataset/6331978
