17,,,,141.036,4762687572,2577985057.0,2607745862,14825391,4717684371.0,,PRJNA238498,SAMN02644834,https://www.ncbi.nlm.nih.gov/biosample/2644834,"MIMS.me, MIGS/MIMS/MIMARKS.microbial",MIMS.me.microbial.4.0,2644834.0,23-05-2012,,"Mon, 03 Jul 2017 20:28:46 -0000",SRA,653210,<5m,,8623961129.0,1m,sponge,shallow bay,water,MIGS/MIMS/MIMARKS.microbial,,,,SRX472720,https://www.ncbi.nlm.nih.gov/sra/653210,Metagenomic study of sponge-associated microbial community treated by copper,,0.353586,Hong Kong: Clear Water Bay,,533696.0,Illumina HiSeq 2000,metagenome,,"22.275297, 114.294119",,paired,,,52046668.0,,metagenomic,WGS,,22.2753,114.294,"Tue, 18 Feb 2014 04:33:52 -0000",microbial mat/biofilm,metagenome,1.0,MIMS,1.0,illumina,1385788.0,,1.0,,"Renmao TIAN, rtian@ust.hk",HONG KONG UNIVERSITY OF SCIENCE AND TECHNOLOGY,,,,,SRR1171647,"{""24"": 45486671, ""25"": 95972880, ""26"": 71684497, ""27"": 67926316, ""20"": 29903596, ""21"": 10243834, ""22"": 22408279, ""23"": 32694201, ""28"": 49973822, ""29"": 160390106, ""40"": 978011056, ""41"": 3436075986, ""2"": 459425629, ""5"": 1853577, ""7"": 29135505, ""6"": 1921941, ""9"": 17813166, ""8"": 20768296, ""39"": 1166259570, ""38"": 433206086, ""11"": 7830345, ""10"": 18026211, ""13"": 13037688, ""12"": 3795466, ""15"": 12618990, ""14"": 4234561, ""17"": 13338441, ""16"": 11243682, ""19"": 35719051, ""18"": 29284052, ""31"": 282099055, ""30"": 142536756, ""37"": 1053011777, ""36"": 1106741360, ""35"": 3337912836, ""34"": 972451807, ""33"": 283422241, ""32"": 222468920}","{""env_feature"": ""shallow bay"", ""elev"": ""1m"", ""collection_date"": ""23-05-2012"", ""env_package"": ""MIGS/MIMS/MIMARKS.microbial"", ""env_biome"": ""sponge"", ""investigation_type"": ""metagenome"", ""depth"": ""<5m"", ""geo_loc_name"": ""Hong Kong: Clear Water Bay"", ""env_material"": ""water"", ""lat_lon"": ""22.275297, 114.294119""}",This study is about the effect of copper on the microbial community of sponge Haliclona cymaeformis.,SRS559156,Metagenome sample for Haliclona cymaeformis treated by copper,,illumina,,,This project studies the effect of copper on microibal community in sponge by metagenomic sequencing.,,SRP038115,,Metagenome of sponge Haliclona cymaeformis treated by copper,Metagenomics,,SRA140534,,,,,Haliclona cymaeformis,,14680928253.0,/dataset/533696
18,,,,150.0,3582619851,3053996788.0,3139341776,910124,3484289761.0,,PRJEB27640,SAMEA4790993,https://www.ncbi.nlm.nih.gov/biosample/10824451,Generic,Generic.1.0,10824451.0,2014-07-07,,"Sat, 04 May 2019 11:26:45 -0000",SRA,7230334,,,6019653303.0,,,,,built environment,,,,ERX2714196,https://www.ncbi.nlm.nih.gov/sra/7230334,Illumina HiSeq 2500 paired end sequencing,,0.0,Germany,,4533688.0,Illumina HiSeq 2500,metagenome,,,53.953343,paired,,indoor shotgun metagenome,44203861.0,RANDOM,metagenomic,WGS,10.034461,53.9533,10.0345,"Thu, 24 Jan 2019 00:00:00 -0000",built environment,metagenome,1.0,MIMS,1.0,illumina,1256227.0,,1.0,,,Medical Univeristy of Graz,,Comparative metagenomics of controlled and uncontrolled built environments,,,ERR2699809,,"{""INSDC last update"": ""2018-07-15T21:13:47Z"", ""rel_air_humidity"": ""59.75"", ""Title"": ""F"", ""organism_count"": ""10160839.58"", ""abs_air_humidity"": ""0.01"", ""heat_cool_type"": ""heat pump"", ""collection_date"": ""2014-07-07"", ""space_typ_state"": ""typically occupied"", ""ventilation_type"": ""natural ventilation"", ""env_local_scale"": ""uncontrolled"", ""investigation_type"": ""metagenome"", ""geo_loc_name"": ""Germany"", ""sample_name"": ""ERS2610923"", ""building_setting"": ""rural"", ""geographic location (latitude)"": ""53.953343"", ""geographic location (longitude)"": ""10.034461"", ""project_name"": ""Comparative metagenomics of controlled and uncontrolled built environments"", ""description"": ""foresters house"", ""indoor_space"": ""kitchen"", ""filter_type"": ""ultraviolet air treatment"", ""env_medium"": ""polymer tiles stone"", ""occup_samp"": ""1"", ""Alias"": ""F_TAGCTT"", ""INSDC status"": ""public"", ""sequencing method"": ""Illumina"", ""build_occup_type"": ""residential"", ""env_broad_scale"": ""indoor environment"", ""built environment environmental package"": ""built environment"", ""INSDC first public"": ""2019-01-24T17:03:10Z"", ""air_temp"": ""19.375"", ""SRA accession"": ""ERS2610923"", ""INSDC center alias"": ""Medical Univeristy of Graz"", ""carb_dioxide"": ""440"", ""occupant_dens_samp"": ""2"", ""ENA checklist"": ""ERC000031"", ""light_type"": ""electric light"", ""INSDC center name"": ""Medical Univeristy of Graz"", ""typ_occupant_dens"": ""1""}",,ERS2610923,F_TAGCTT,,Illumina,,,"Antimicrobial resistance is an increasingly serious threat to global public health, but less is known how microbial control in health care or cleanroom facilities modifies the in-house microbiota and its associated resistome. To understand these human interventions, we compared the microbiota present in abiotic surfaces of clinical settings and other built environments. State-of-the-art metagenomic assembly and binning strategies as well as genome and plasmid reconstructions allowed us to determine that increased confinement and cleaning was associated with a loss of microbial diversity and a shift from Gram-positive (Actinobacteria, Firmicutes) to Gram-negative (Proteobacteria) bacteria as well as within genomes (Acinetobacter). Moreover, the microbiome of highly maintained built environments showed a completely different resistome and present a higher diversity of resistance genes than naturally unrestricted buildings. Our results highlight that the loss of microbial diversity correlates with an increase of resistances and indicate the need of implementing strategies to restore diversity to counteract propagation of resistances in the future.","{""ENA-FIRST-PUBLIC"": ""2019-01-23"", ""ENA-LAST-UPDATE"": ""2018-07-06""}",ERP109748,,Comparative metagenomics of controlled and uncontrolled built environments.,Other,,ERA1545701,,,,,indoor metagenome,,13261158300.0,/dataset/4533688
19,,,,97.0,1499223380,1095861280.0,1093108786,33491,1496594049.0,,PRJEB12124,SAMEA3708756,https://www.ncbi.nlm.nih.gov/biosample/4955087,Generic,Generic.1.0,4955087.0,2014,,"Fri, 11 Aug 2017 02:27:19 -0000",SRA,2500656,,,3929929544.0,,human gut,human-associated habitat,faeces,human-gut,,,,ERX1264205,https://www.ncbi.nlm.nih.gov/sra/2500656,Illumina HiSeq 2500 paired end sequencing,,0.0,China,,2570675.0,Illumina HiSeq 2500,metagenome,,,55.676097,paired,,RSZAXPI002958-18,26460847.0,other,metagenomic,WGS,12.568337,55.6761,12.5683,"Fri, 21 Oct 2016 00:00:00 -0000",human-gut,metagenome,1.0,MIMS,1.0,illumina,408170.0,,1.0,,,BGI,,MetaHIT-IGC,,,ERR1190830,,"{""env_feature"": ""human-associated habitat"", ""project_name"": ""MetaHIT-IGC"", ""geographic location (country and/or sea)"": ""China"", ""collection_date"": ""2014"", ""env_biome"": ""human gut"", ""longitude"": ""12.568337"", ""env_material"": ""faeces"", ""latitude"": ""55.676097"", ""sequencing method"": ""Illumina"", ""geo_loc_name"": ""China"", ""sample_name"": ""ERS1015905"", ""human gut environmental package"": ""human-gut"", ""investigation_type"": ""metagenome""}",,ERS1015905,P028V6; Stool sample from China,,Illumina,,,"Dysbosis of intestinal microbiota could contribute to the pathogenesis of Type 2 Diabetes. It is yet to be known whether intestinal flora could be related to differential responds to antidiabetic therapies. This study, herein for the first time, metagenomic sequenced fecal samples from a randomized clinical trial on new onset untreated Type 2 Diabetes patients applied two treatment arms, Acarbose and Glipizide (Sulfonylurea) and analyzed the differential responses of intestinal flora in different groups. Results showed substantial impact of Acarbose on gut microbiota community but minor of Glipizide. Enterotypes with similar baseline clinical characteristics, had significant different pharmacologic respond to Acarbose on insulin resistance, gut hormones, bile acids and cardiovascular risks, indicating that different pattern of intestinal microbiota component could determine different responses of Type 2 Diabetes to antidiabetic pharmacological therapies.",,ERP013563,,Gut microbiome-dependent stratification of patients for anti-diabetic treatment,Other,,ERA542780,,,,P028V6,human gut metagenome,,5184820986.0,/dataset/2570675
20,,,,97.1558,1755872147,1641799900.0,1648856804,340691,1762343353.0,,PRJNA342017,SAMN05861671,https://www.ncbi.nlm.nih.gov/biosample/5861671,"MIMS.me, MIGS/MIMS/MIMARKS.water",MIMS.me.water.4.0,5861671.0,11-Jul-2012,,"Mon, 03 Jul 2017 09:34:30 -0000",SRA,3245916,100,,4809594975.0,,not collected,farm,not collected,,,,,SRX2210424,https://www.ncbi.nlm.nih.gov/sra/3245916,"California dairy domestic groundwater metagenome, July 2012 (filtered unmerged paired-end reads)",,0.48328999999999994,USA:California:San Joaquin Valley,,310558.0,Illumina HiSeq 2000,,,,,paired,,dairy-domestic-filtered-paired,35042733.0,RANDOM,metagenomic,WGS,,,,"Tue, 14 Mar 2017 00:37:43 -0000",water,metagenome,1.0,MIMS,1.0,illumina,717931.0,,1.0,"Molecular and Cell Biology, University of California, Berkeley, 441 Life Sciences Addition, Berkeley, CA, USA","Thaddeus Seher, tdseher@ucdavis.edu","University of California, Berkeley",,,,,SRR4343439,"{""24"": 46806378, ""25"": 55586165, ""26"": 53593952, ""27"": 79719877, ""20"": 32314113, ""21"": 8792265, ""22"": 14665158, ""23"": 35292743, ""28"": 32994300, ""29"": 115044767, ""40"": 672390679, ""41"": 1171148014, ""2"": 340691, ""5"": 4978216, ""7"": 16495827, ""6"": 3293913, ""9"": 3567524, ""8"": 10029947, ""39"": 611460680, ""38"": 354996720, ""11"": 3425226, ""10"": 7547806, ""13"": 3800529, ""12"": 5134080, ""15"": 13690496, ""14"": 3033489, ""17"": 10011661, ""16"": 6179373, ""19"": 13627178, ""18"": 23297019, ""31"": 239503307, ""30"": 128620276, ""37"": 569272681, ""36"": 284413703, ""35"": 1092910384, ""34"": 572085571, ""33"": 348038207, ""32"": 161109980}","{""copper"": ""ND"", ""sodium_absorption_ratio"": ""1.80"", ""env_biome"": ""not collected"", ""zinc"": ""ND"", ""chromium"": ""ND"", ""lat_lon"": ""missing"", ""env_feature"": ""farm"", ""lead"": ""0.012 ppm"", ""sodium"": ""1.58 ppm"", ""collection_date"": ""11-Jul-2012"", ""carbonate"": ""0.10 ppm"", ""sulfate"": ""2.30 ppm"", ""geo_loc_name"": ""USA:California:San Joaquin Valley"", ""nitrate"": ""4.30 ppm"", ""ph"": ""8.17"", ""chloride"": ""0.43 ppm"", ""nickel"": ""ND"", ""bicarbonate"": ""1.90 ppm"", ""potassium"": ""4.64 ppm"", ""env_material"": ""not collected"", ""diss_org_carb"": ""0.70 ppm"", ""cadmium"": ""ND"", ""boron"": ""0.13 ppm"", ""ammonium"": ""ND"", ""conduc"": ""0.32 dS/m"", ""manganese"": ""0.073 ppm"", ""calcium"": ""0.98 ppm"", ""depth"": ""100"", ""magnesium"": ""0.61 ppm"", ""iron"": ""ND""}",Keywords: GSC:MIxS;MIMS:4.0,SRS1727571,"California dairy domestic groundwater metagenome, July 2012",,illumina,,,The purpose of this project was to determine the phylogenetic signature and biosynthetic potential of shallow agriculture-contaminated groundwater in California.,,SRP090828,,groundwater metagenome Metagenome,Metagenomics,,SRA481916,,,,,groundwater metagenome,,6809212895.0,/dataset/310558
21,,,,151.0,4320967877,3883992754.0,3900157887,2219817,4271337215.0,,PRJEB22062,SAMEA104467354,https://www.ncbi.nlm.nih.gov/biosample/9712291,Generic,Generic.1.0,9712291.0,2015,,"Mon, 06 May 2019 03:08:19 -0000",SRA,6038692,,,6473886116.0,,,,,host-associated,,,,ERX2294009,https://www.ncbi.nlm.nih.gov/sra/6038692,Illumina HiSeq 3000 paired end sequencing,,0.0,Italy,,4764533.0,Illumina HiSeq 3000,metagenome,,,42.7339 N,paired,,Nextera TX,54234025.0,RANDOM,metagenomic,WGS,25.4858 E,42.7339,25.4858,"Tue, 24 Jul 2018 00:00:00 -0000",host-associated,metagenome,1.0,MIMS,1.0,,256318.0,,1.0,,,DTU CGE,,Gut microbiomes from 359 European pig and poultry herds (EFFORT),,,ERR2241851,,"{""INSDC last update"": ""2018-01-11T15:12:12Z"", ""Title"": ""NL-PooledPig-F1-S228"", ""collection_date"": ""2015"", ""env_local_scale"": ""gut"", ""investigation_type"": ""metagenome"", ""geo_loc_name"": ""Italy"", ""sample_name"": ""ERS2085296"", ""geographic location (latitude)"": ""42.7339 N"", ""geographic location (longitude)"": ""25.4858 E"", ""project_name"": ""Gut microbiomes from 359 European pig and poultry herds (EFFORT)"", ""description"": ""F corresponds to Farm number; S corresponds to sample number"", ""env_medium"": ""faeces"", ""Alias"": ""602618001"", ""INSDC status"": ""public"", ""sequencing method"": ""Illumina HiSeq (shotgun)"", ""env_broad_scale"": ""poultry"", ""INSDC first public"": ""2018-07-24T17:03:10Z"", ""host-associated environmental package"": ""host-associated"", ""SRA accession"": ""ERS2085296"", ""INSDC center alias"": ""DTU CGE"", ""Broker name"": ""Centre for Genomic Epidemiology"", ""ENA checklist"": ""ERC000013"", ""INSDC center name"": ""DTU CGE""}",,ERS2085296,602618001,,Illumina HiSeq (shotgun),,,"Antimicrobial resistance (AMR) in bacteria and associated morbidity and mortality is increasing. Use of antimicrobials for livestock selects for AMR that can subsequently be transferred to the human reservoir. This flow of AMR between reservoirs demands surveillance in livestock as well as in humans. As part of the EFFORT project (http://www.effort-against-amr.eu/), we have quantified and characterized the acquired resistance gene pools (resistomes) of 181 pig and 178 poultry farms from nine European countries, generating more than 5,000 Gigabases of DNA sequence, using shotgun metagenomics. The pig and poultry resistomes were very different in abundance and composition. There was a significant country effect on the resistomes, more so in pigs than poultry. We found higher AMR loads in pigs, while poultry resistomes were more diverse. We detected several newly described, critical AMR genes, including mcr-1 and optrA, which differed both between host species and countries. We found that the total AMR level, was associated with the overall country-specific antimicrobial usage in livestock and that countries with comparable usage patterns have similar resistomes.","{""ENA-FIRST-PUBLIC"": ""2018-07-23"", ""ENA-LAST-UPDATE"": ""2017-08-04""}",ERP024389,,"As part of the EFFORT project, we sampled feces from pig and poultry livestock in nine European countries (BE, BG, DK, FR, ES, GE, NL, PL, SP). More than 9000 animals were sampled, across 181 pig and 178 poultry herds to generate herd-level composite fecal samples. Using shotgun metagenomics, we have quantified and characterized the antimicrobial resistance gene pools (resistomes) in Europe's two most intensively raised livestock species.",Other,,ERA1179253,,,,,metagenome,,16378675550.0,/dataset/4764533
22,,,,251.0,776630961,1320502314.0,1315010255,383731,771110117.0,,PRJEB18701,SAMEA103892605,https://www.ncbi.nlm.nih.gov/biosample/9586676,Generic,Generic.1.0,9586676.0,2014/2015,,"Mon, 29 Apr 2019 12:41:15 -0000",SRA,5886933,0,,2553803344.0,0,,,,soil,,,,ERX1938446,https://www.ncbi.nlm.nih.gov/sra/5886933,Illumina HiSeq 2500 paired end sequencing,,0.0,Zimbabwe,,3792415.0,Illumina HiSeq 2500,metagenome,,,-20.01863,paired,,,8333939.0,RANDOM,metagenomic,WGS,29.47745,-20.0186,29.4774,"Thu, 31 May 2018 00:00:00 -0000",soil,metagenome,1.0,MIMS,1.0,illumina,410658.0,,1.0,,,European Molecular Biology Laboratory,,18S metabarcoding data of global soil samples,,,ERR1877921,,"{""INSDC last update"": ""2017-03-06T16:33:21Z"", ""Title"": ""soil sample"", ""geographic location (depth)"": ""0"", ""collection_date"": ""2014/2015"", ""env_local_scale"": ""-"", ""investigation_type"": ""metagenome"", ""geo_loc_name"": ""Zimbabwe"", ""sample_name"": ""ERS1581773"", ""geographic location (latitude)"": ""-20.01863"", ""project_name"": ""18S metabarcoding data of global soil samples"", ""ENA checklist"": ""ERC000022"", ""env_medium"": ""soil"", ""Alias"": ""S068"", ""INSDC status"": ""public"", ""sequencing method"": ""Illumina"", ""env_broad_scale"": ""Savannas"", ""INSDC first public"": ""2018-05-31T17:02:46Z"", ""geographic location (longitude)"": ""29.47745"", ""INSDC center alias"": ""EMBL"", ""soil environmental package"": ""soil"", ""SRA accession"": ""ERS1581773"", ""INSDC center name"": ""European Molecular Biology Laboratory"", ""geographic location (elevation)"": ""0""}",,ERS1581773,S068,,Illumina,,,"Soils harbour some of the most diverse microbiomes on Earth and are essential for both nutrient cycling and carbon storage. To understand soil functioning, it is necessary to model the global distribution patterns and functional gene repertoires of soil microorganisms, as well as the biotic and environmental associations between the diversity and structure of both bacterial and fungal soil communities. Here we show, by leveraging metagenomics and metabarcoding of global topsoil samples (189 sites, 7,560 subsamples), that bacterial, but not fungal, genetic diversity is highest in temperate habitats and that microbial gene composition varies more strongly with environmental variables than with geographic distance. We demonstrate that fungi and bacteria show global niche differentiation that is associated with contrasting diversity responses to precipitation and soil pH. Furthermore, we provide evidence for strong bacterial–fungal antagonism, inferred from antibiotic-resistance genes, in topsoil and ocean habitats, indicating the substantial role of biotic interactions in shaping microbial communities. Our results suggest that both competition and environmental filtering affect the abundance, composition and encoded gene functions of bacterial and fungal communities, indicating that the relative contributions of these microorganisms to global nutrient cycling varies spatially.","{""ENA-FIRST-PUBLIC"": ""2018-05-30"", ""ENA-LAST-UPDATE"": ""2018-11-18""}",ERP020652,"{""PUBMED"": ""30069051""}",Global analysis of soil microbiomes,Other,,ERA836085,,,,,soil metagenome,,4183637378.0,/dataset/3792415
23,,,,105.0,84600525,90487639.0,91317880,1800128,84118790.0,,PRJEB18063,SAMEA4559717,https://www.ncbi.nlm.nih.gov/biosample/8405996,Generic,Generic.1.0,8405996.0,2015,,"Sat, 04 May 2019 09:16:42 -0000",SRA,4993727,0.3,,149602546.0,0,,,,sediment,,,,ERX1812510,https://www.ncbi.nlm.nih.gov/sra/4993727,NextSeq 550 paired end sequencing,,0.0,Canada,,4518005.0,NextSeq 550,metagenome,,,46°27'9.60N,paired,,Shotgun_mesocosms,1666623.0,RANDOM,metagenomic,WGS,80°56'35.42W,,,"Tue, 23 Jan 2018 00:00:00 -0000",sediment,metagenome,1.0,MIMS,1.0,illumina,256318.0,,1.0,,,UNIVERSITY OF CAMBRIDGE,,Sudbury lake mesocosms,,,ERR1743304,,"{""INSDC last update"": ""2016-11-25T16:20:33Z"", ""Title"": ""Sudbury lake mesocosms"", ""sediment environmental package"": ""sediment"", ""geographic location (depth)"": ""0.3"", ""collection_date"": ""2015"", ""env_local_scale"": ""lake"", ""investigation_type"": ""metagenome"", ""geo_loc_name"": ""Canada"", ""sample_name"": ""ERS1458896"", ""geographic location (latitude)"": ""46\u00b027'9.60N"", ""project_name"": ""Sudbury lake mesocosms"", ""ENA checklist"": ""ERC000021"", ""env_medium"": ""sediment"", ""Alias"": ""31"", ""INSDC status"": ""public"", ""sequencing method"": ""Illumina NextSeq"", ""env_broad_scale"": ""Boreal"", ""INSDC first public"": ""2018-01-23T17:05:43Z"", ""geographic location (longitude)"": ""80\u00b056'35.42W"", ""SRA accession"": ""ERS1458896"", ""INSDC center name"": ""UNIVERSITY OF CAMBRIDGE"", ""geographic location (elevation)"": ""0""}",,ERS1458896,31,,Illumina NextSeq,,,"Lake ecosystems provide important services including their ability to support complex food webs, and their connection to the global carbon cycle. These services are dependent on how microorganisms interact with available organic matter (OM), both dissolved and particulate. Therefore, in order to manage these important ecosystems and their services successfully, it is necessary to understand how the quality and quantity of DOM affects microbial communities. Linking DOM quality and quantity to microbial community complexity and function are crucial steps toward a mechanistic understanding of freshwater ecosystems. Understanding these relationships at the microbial scale will enable us to make predictions about landscape-scale environmental change and its effect on aquatic carbon cycling and food web processes. In this study, I aim to investigate the effect of organic matter manipulation on the molecular structure of DOM and the microbial community composition and function in freshwater boreal lakes.","{""ENA-FIRST-PUBLIC"": ""2018-01-23"", ""ENA-LAST-UPDATE"": ""2016-11-25""}",ERP019980,,Effects of organic matter manipulation on bacterial community diversity and function,Other,,ERA769156,,,,,metagenome,,352324962.0,/dataset/4518005
24,,,,150.0,835142179,949074572.0,951732479,18407,834815663.0,,PRJEB20771,SAMEA104055888,https://www.ncbi.nlm.nih.gov/biosample/9629615,Generic,Generic.1.0,9629615.0,2014-03-01,,"Sun, 05 May 2019 12:38:21 -0000",SRA,5930428,,,1881719083.0,,,,,wastewater/sludge,,,,ERX2023531,https://www.ncbi.nlm.nih.gov/sra/5930428,Illumina HiSeq 2500 paired end sequencing,,0.0,Hong Kong,,4701211.0,Illumina HiSeq 2500,metagenome,,,22.508829N,paired,PE150,220meta,11902611.0,size fractionation,metagenomic,WGS,114.119894E,22.5088,114.12,"Sat, 07 Jul 2018 00:00:00 -0000",wastewater/sludge,metagenome,1.0,MIMS,1.0,illumina,290402.0,,1.0,,,shuixia100,,metagenome of CEPT sludge,,,ERR1960627,,"{""INSDC last update"": ""2017-05-09T10:26:36Z"", ""project_name"": ""metagenome of CEPT sludge"", ""wastewater/sludge environmental package"": ""wastewater/sludge"", ""Title"": ""metagenome of CEPT sludge"", ""collection_date"": ""2014-03-01"", ""SRA accession"": ""ERS1719781"", ""sample_name"": ""ERS1719781"", ""env_local_scale"": ""Chemical Enhanced Primary Treatment sludge"", ""geographic location (latitude)"": ""22.508829N"", ""env_medium"": ""waste sludge"", ""INSDC center alias"": ""shuixia100"", ""Alias"": ""DNA-CEPT1"", ""INSDC status"": ""public"", ""sequencing method"": ""Illumina"", ""geo_loc_name"": ""Hong Kong"", ""ENA checklist"": ""ERC000023"", ""env_broad_scale"": ""waste sludge"", ""INSDC center name"": ""shuixia100"", ""investigation_type"": ""metagenome"", ""INSDC first public"": ""2018-07-07T17:02:38Z"", ""geographic location (longitude)"": ""114.119894E""}",,ERS1719781,DNA-CEPT1,,Illumina,,,"Hong Kong has the world's largest scale application of Chemical Enhanced Primary Treatment process. The CEPT sludge was collected from local treatment facility. Ultrasonic treatment was applied to enhance the hydrolysis of the CEPT sludge before anaerobic digestion. In order to investigate the effect of ultrasonic treatment on the digestibility of CEPT sludge and corresponding microbial community, anaerobic digestion of ultrasound-treated CEPT sludge was carried out in lab-scale sequential batch reactors. Metatranscriptomes and metagenomes were constructed for the community in the batch reactor at three independent cycles.","{""ENA-FIRST-PUBLIC"": ""2018-07-07"", ""ENA-LAST-UPDATE"": ""2017-05-09""}",ERP022950,,Ultrasonic treatment was used treat the CEPT sludge. Metatranscriptomic analysis was used to characterize the microbial community of anaerobic digestion of Ultrasonic-treated CEPT sludge,Other,,ERA912593,,,,,Clostridium beijerinckii NCIMB 8052,,3570783300.0,/dataset/4701211
