76,,,,101.0,836416838,1076611335.0,1203536822,1589154,735394801.0,,PRJNA246597,SAMN02799093,https://www.ncbi.nlm.nih.gov/biosample/2799093,"MIMS.me, MIGS/MIMS/MIMARKS.miscellaneous",MIMS.me.miscellaneous.4.0,2799093.0,2012,,"Sat, 05 Aug 2017 16:28:20 -0000",SRA,789902,,,2433013673.0,,not collected,not collected,human bone,,,,,SRX552936,https://www.ncbi.nlm.nih.gov/sra/789902,NA47 pre-capture,,0.0,"Laguna de los Condores, Peru",,1998572.0,Illumina HiSeq 2500,,,6Â¡ 50' 55.7088'' S 77Â¡ 41' 52.7604'' W,,paired,,NA47,19076975.0,RANDOM,metagenomic,WGS,,,,"Fri, 23 May 2014 14:07:12 -0000",miscellaneous,metagenome,1.0,MIMS,1.0,illumina,9606.0,,1.0,,"Josh Weinstein, jaweinst@stanford.edu",Stanford University,,,,,SRR1298754,,"{""env_feature"": ""not collected"", ""collection_date"": ""2012"", ""env_biome"": ""not collected"", ""env_material"": ""human bone"", ""geo_loc_name"": ""Laguna de los Condores, Peru"", ""sample_ID"": ""11"", ""lat_lon"": ""6\u00c2\u00a1 50' 55.7088'' S 77\u00c2\u00a1 41' 52.7604'' W""}",Samples NA39-50 were obtained from pre-Columbian Chachapoyan and Chachapoya-Inca remains dating between 1000 and 1500 AD. They were recovered from the site Laguna de los Condores in northeastern Peru. Bone samples were used for DNA analysis.,SRS620297,MIMS Environmental/Metagenome sample from Homo sapiens,,illumina,,,"Pre- and post-capture shotgun sequencing data from four Iron- and Bronze-Age teeth from Bulgaria, one Bronze Age hair sample from Denmark, and seven pre-Columbian Chachapoya mummies from Peru.",,SRP042225,"{""pubmed"": ""24568772""}","Shotgun and whole-genome-enriched DNA extracted from ancient human teeth, bones, and hair, which includes both endogenous and environmental sequences",Other,,SRA166868,,,,,Homo sapiens,,3853548950.0,/dataset/1998572
77,,,,96.0,2502567458,2409504518.0,2303648064,357292221,2411860957.0,,PRJNA197372,SAMN02047254,https://www.ncbi.nlm.nih.gov/biosample/2047254,"MIMS.me, MIGS/MIMS/MIMARKS.microbial",MIMS.me.microbial.4.0,2047254.0,2/27/10,,"Sun, 13 Aug 2017 20:13:00 -0000",SRA,374668,0 m,,6170173426.0,0 m,marine,marine,microbial mat,MIGS/MIMS/MIMARKS.microbial,,,Replicate Lane 2 (Thr-B) of thrombolitic mat metagenomic DNA,SRX268150,https://www.ncbi.nlm.nih.gov/sra/374668,Highborne Cay thrombolite metagenome,,0.0,"Highborne Cay, Bahamas",,2723757.0,Illumina Genome Analyzer IIx,metagenome,,"76""""49'W, 24""""43'N",,paired,,Thr-B,51706578.0,,metagenomic,WGS,,,,"Wed, 19 Jun 2013 07:44:10 -0000",microbial mat/biofilm,metagenome,1.0,MIMS,1.0,illumina,527640.0,,1.0,,", jmobbes@ufl.edu",UNIVERSITY OF FLORIDA,,HBC thrombolite metagenome,,,SRR830624,,"{""env_feature"": ""marine"", ""project_name"": ""HBC thrombolite metagenome"", ""elev"": ""0 m"", ""collection_date"": ""2/27/10"", ""env_package"": ""MIGS/MIMS/MIMARKS.microbial"", ""env_biome"": ""marine"", ""investigation_type"": ""metagenome"", ""depth"": ""0 m"", ""geo_loc_name"": ""Highborne Cay, Bahamas"", ""env_material"": ""microbial mat"", ""lat_lon"": ""76\""\""49'W, 24\""\""43'N""}",Keywords: GSC:MIxS;MIMS:4.0,SRS415117,MIMS Environmental/Metagenome sample from microbial,,illumina,,,"Metagenome of a intertidal thrombolitic mat community from Highborne Cay, Bahamas.",,SRP021141,,HBC thrombolite metagenome,Metagenomics,,SRA073595,,,,,microbial mat metagenome,,9984873218.0,/dataset/2723757
78,,,,101.0,1817642524,1636167417.0,1476234535,871176,1917133616.0,,PRJEB13117,SAMEA3904682,https://www.ncbi.nlm.nih.gov/biosample/5158036,Generic,Generic.1.0,5158036.0,2013-06-06,,"Mon, 03 Jul 2017 11:00:51 -0000",SRA,2554496,,,3835655979.0,,Builtin,hospital,surface,built environment,,,,ERX1404192,https://www.ncbi.nlm.nih.gov/sra/2554496,Illumina HiSeq 1500 paired end sequencing,,0.454553,USA,,347315.0,Illumina HiSeq 1500,metagenome,,,41.779857,paired,,,33901234.0,RANDOM PCR,metagenomic,WGS,-87.600099,41.7799,-87.6001,"Sun, 20 Nov 2016 00:00:00 -0000",built environment,metagenome,1.0,MIMS,1.0,illumina,256318.0,,1.0,,,Naseer,,hospital metagenome,,,ERR1332600,"{""24"": 13300154, ""25"": 17066111, ""26"": 17041005, ""27"": 20998434, ""20"": 10127436, ""21"": 2204194, ""22"": 4266156, ""23"": 9697383, ""28"": 13093291, ""29"": 36285742, ""40"": 538638228, ""41"": 2483974007, ""2"": 127594894, ""5"": 1273927, ""7"": 6377152, ""6"": 1145870, ""9"": 1383731, ""8"": 4265803, ""39"": 713594620, ""38"": 155150573, ""11"": 3303604, ""10"": 3671867, ""13"": 3969430, ""12"": 1807342, ""15"": 4180419, ""14"": 871744, ""17"": 4007352, ""16"": 2551842, ""19"": 5704577, ""18"": 7043037, ""31"": 82233883, ""30"": 42214836, ""37"": 611923319, ""36"": 282811779, ""35"": 1056818054, ""34"": 355297905, ""33"": 143579743, ""32"": 58579824}","{""rel_air_humidity"": ""0"", ""organism_count"": ""10000"", ""abs_air_humidity"": ""0"", ""env_feature"": ""hospital"", ""heat_cool_type"": ""forced air system"", ""geographic location (country and/or sea)"": ""USA"", ""collection_date"": ""2013-06-06"", ""space_typ_state"": ""typically occupied"", ""ventilation_type"": ""mechanical ventilation"", ""env_biome"": ""Builtin"", ""investigation_type"": ""metagenome"", ""sample_name"": ""ERS1091816"", ""latitude"": ""41.779857"", ""building_setting"": ""urban"", ""typ_occupant_dens"": ""300"", ""project_name"": ""hospital metagenome"", ""indoor_space"": ""bedroom"", ""filter_type"": ""electrostatic air treatment"", ""env_material"": ""surface"", ""occup_samp"": ""100"", ""sequencing method"": ""Illumina"", ""build_occup_type"": ""goverment"", ""built environment environmental package"": ""built environment"", ""air_temp"": ""0"", ""longitude"": ""-87.600099"", ""carb_dioxide"": ""0"", ""occupant_dens_samp"": ""100"", ""light_type"": ""electric light""}",,ERS1091816,4246; Patient has blood stream infection,,Illumina,,,"The microorganisms that inhabit hospitals may significantly influence patient recovery rates and outcomes, though the complexity and diversity of these communities confound our ability to focus on potential pathogens in isolation. To develop a community level understating of how microorganisms colonize and move through the hospital environment, we mapped microbial dynamics between hospital surfaces, air and water to patients and staff over the course of one year as a new hospital became operational. Immediately following the introduction of staff and patients, the hospital microbiome became dominated by human skin-associated bacteria. Patient skin samples had the lowest microbial diversity, while the greatest diversity was found on surfaces interacting with outdoor environments. The microbiota of patient room surfaces, especially bedrails, consistently resembled the skin microbial community of the current patient within 24 hours of occupancy, with degree of similarity significantly correlated to higher humidity and lower temperatures. Microbial similarity between staff members showed a significant seasonal trend suggesting interpersonal microbial transmission in hospital environments is influenced by built environment parameters.",,ERP014653,,Hospital Metagenomics,Other,,ERA587179,,,,,metagenome,,6848049268.0,/dataset/347315
79,,,,150.0,2831528461,2827038646.0,2793569589,895749,2805451855.0,,PRJEB24152,SAMEA5669781,https://www.ncbi.nlm.nih.gov/biosample/12432079,Generic,Generic.1.0,12432079.0,2017,,"Mon, 23 Sep 2019 22:49:56 -0000",SRA,9020739,,,5016170454.0,,,,,human-gut,,,,ERX3541325,https://www.ncbi.nlm.nih.gov/sra/9020739,Illumina HiSeq 4000 paired end sequencing,,0.0,USA,,6653691.0,Illumina HiSeq 4000,metagenome,,,44.024391,paired,Nextera,,37528281.0,PCR,metagenomic,WGS,-92.465956,44.0244,-92.46600000000001,"Fri, 02 Aug 2019 10:11:51 -0000",human-gut,metagenome,1.0,MIMS,1.0,illumina,10090.0,,1.0,,,UNIVERSITY OF MINNESOTA,,Wild primate microbiomes and obesity,,,ERR3521978,,"{""host_diet"": ""low"", ""project_name"": ""Wild primate microbiomes and obesity"", ""collection_date"": ""2017"", ""geographic location (longitude)"": ""-92.465956"", ""env_local_scale"": ""cecum"", ""env_medium"": ""tissue and fecal content"", ""human gut environmental package"": ""human-gut"", ""ENA-FIRST-PUBLIC"": ""2019-08-01"", ""host_tissue_sampled"": ""cecum"", ""geo_loc_name"": ""USA"", ""target subfragment"": ""V4"", ""env_broad_scale"": ""intestine"", ""sequencing method"": ""Illumina MiSeq"", ""investigation_type"": ""metagenome"", ""ENA-LAST-UPDATE"": ""2019-05-31"", ""geographic location (latitude)"": ""44.024391""}",,ERS3473788,clf10cecr,,Illumina MiSeq,,,"Microbiomes influence many aspects of health, but no cost-efficient method precisely characterizes a microbiome's species and genes. Deep shotgun sequencing provides strain-level taxonomic and functional resolution, but is expensive; 16S rRNA gene sequencing limits taxonomic resolution and functional predictions. We find that shallow shotgun sequencing of 500K-1M reads/sample matches ultra-deep sequencing of 2.5B reads/sample on human microbiome samples for species-level taxonomic and functional annotation and clinical biomarker discovery.","{"""": null, ""ENA-FIRST-PUBLIC"": ""2018-03-01"", ""ENA-LAST-UPDATE"": ""2017-12-29""}",ERP105959,,Ultra-deep shotgun sequencing,Other,,ERA2123048,,,V4,house mouse,Mus musculus,cecum,11258484300.0,/dataset/6653691
80,,,,151.0,142412037,127744980.0,127708935,817549,141449841.0,,PRJNA237344,SAMN02628403,https://www.ncbi.nlm.nih.gov/biosample/2628403,"MIMS.me, MIGS/MIMS/MIMARKS.water",MIMS.me.water.4.0,2628403.0,2010-05-26,0823,"Tue, 08 Aug 2017 23:31:26 -0000",SRA,672900,3.76 m,,350890418.0,,surface seawater,Amazon River Plume,water,MIGS/MIMS/MIMARKS.water,,,,SRX482827,https://www.ncbi.nlm.nih.gov/sra/672900,May-June 2010 Amazon Plume = 2.0um Metagenome from Station 3 (ACM19),,0.0,Atlantic Ocean:Western Tropical North Atlantic Ocean,,2373181.0,Illumina Genome Analyzer IIx,Metagenome,,7.29 -53.00,,paired,,,1788521.0,RANDOM,metagenomic,WGS,,7.29,-53.0,"Mon, 10 Feb 2014 11:34:10 -0000",water,metagenome,1.0,MIMS,1.0,illumina,1169740.0,,1.0,"Marine Sciences Department, University of Georgia, 325 Sanford Drive, Athens, GA, United States of America","Brandon Satinsky, cbs649@uga.edu",University of Georgia,,,,,SRR1185414,,"{""PAR"": ""65.38 _Em-2sec-1"", ""site_name"": ""Station 3"", ""bacteria_carb_prod"": ""139.68 pmol leu/L/hr"", ""sequencing_method"": ""Illumina PE 150x150"", ""sampling_cruise"": ""R/V Knorr, May-June 2010"", ""oxy_sat"": ""94.43 pct"", ""sequencing_machine"": ""Genome Analyzer IIx"", ""lat_lon"": ""7.29 -53.00"", ""env_feature"": ""Amazon River Plume"", ""density"": ""1018.98 kgm-2"", ""collection_date"": ""2010-05-26"", ""env_biome"": ""surface seawater"", ""investigation_type"": ""Metagenome"", ""geo_loc_name"": ""Atlantic Ocean:Western Tropical North Atlantic Ocean"", ""surf_irradiance"": ""2690.35 _Em-2sec-1"", ""env_material"": ""water"", ""pressure"": ""3.78 Db"", ""beam_trans"": ""92.69 pct"", ""diss_inorg_carb"": ""1846 _mol/kg"", ""std_norm_factor"": ""349248"", ""target_molecules"": ""Genomic DNA"", ""max_filter_size"": ""156 _m"", ""beam_atten"": ""0.30 m-1"", ""temp"": ""28.85 C"", ""fluor"": ""0.28 mgm-3"", ""corr_irradiance"": ""2.42 pct"", ""env_package"": ""MIGS/MIMS/MIMARKS.water"", ""salinity"": ""30.80 PSU"", ""diss_oxy"": ""188.26 _mol/kg"", ""depth"": ""3.76 m"", ""samp_volume"": ""10.4 L"", ""sigma-theta"": ""18.97"", ""min_filter_size"": ""2.0 _m"", ""turbidity"": ""1.12 NTU"", ""collection_time"": ""0823""}",Keywords: GSC:MIxS;MIMS:4.0,SRS567313,MIMS Environmental/Metagenome sample from aquatic metagenome,,Illumina PE 150x150,,,"This project focuses on the Amazon River-to-tropical Atlantic Ocean continuum because of both its immense scale and its apparent sensitivity to climate variability and anthropogenic forcing. The river’s effect on the ocean depends not only on the river hydrology, but what the river carries and how those components are modified during transit from their terrestrial or aquatic origins. We brought together limnologists and oceanographers in an integrated project to improve our understanding of carbon exchange between the atmosphere and this tropical river continuum, focusing on the lower reach, nearshore, and offshore tropical Atlantic, with the goal of improving predictive capabilities under differing climate change scenarios.",,SRP039390,"{""The Amazon Continuum Project Webpage"": ""http://amazoncontinuum.org/""}",Amazon Continuum Metagenomes,Metagenomics,,SRA137082,,,,,aquatic metagenome,,540133342.0,/dataset/2373181
82,,,,101.0,418863132,698581362.0,687977079,18168645,424345976.0,,PRJEB28446,SAMEA4877249,https://www.ncbi.nlm.nih.gov/biosample/9983247,Generic,Generic.1.0,9983247.0,2014-10-03,,"Wed, 15 May 2019 15:19:34 -0000",SRA,6276795,0.1,,826261479.0,473,,,,soil,,,,ERX2780129,https://www.ncbi.nlm.nih.gov/sra/6276795,Illumina HiSeq 2500 sequencing,,0.0,USA,,5573882.0,Illumina HiSeq 2500,metagenome,,,42.430868,single,,,22256794.0,,metagenomic,WGS,-76.23032445,42.4309,-76.2303,"Wed, 05 Sep 2018 00:00:00 -0000",soil,metagenome,1.0,MIMS,1.0,,410658.0,,1.0,,,CORNELL UNIVERSITY,,HRTC,,,ERR2767288,,"{""no3_mg_per_kg_soil"": ""8"", ""INSDC last update"": ""2018-08-31T16:17:31Z"", ""Title"": ""JC04"", ""percent_som"": ""0.36"", ""geographic location (depth)"": ""0.1"", ""collection_date"": ""2014-10-03"", ""env_local_scale"": ""wetland ecosystem"", ""investigation_type"": ""metagenome"", ""geo_loc_name"": ""USA"", ""sample_name"": ""ERS2696217"", ""ph"": ""6.83"", ""geographic location (latitude)"": ""42.430868"", ""project_name"": ""HRTC"", ""description"": ""soil metagenomic sample"", ""ENA checklist"": ""ERC000022"", ""env_medium"": ""soil"", ""Alias"": ""JC04"", ""INSDC status"": ""public"", ""sequencing method"": ""Illumina HiSeq SE"", ""env_broad_scale"": ""wetland ecosystem"", ""INSDC first public"": ""2018-09-05T17:02:08Z"", ""sti_10m"": ""23.3387"", ""geographic location (longitude)"": ""-76.23032445"", ""corresponding_16s_sample_title"": ""CF1"", ""INSDC center alias"": ""CORNELL UNIVERSITY"", ""soil environmental package"": ""soil"", ""SRA accession"": ""ERS2696217"", ""INSDC center name"": ""Cornell University"", ""geographic location (elevation)"": ""473""}",,ERS2696217,JC04,,Illumina HiSeq SE,,,"Relationships among denitrifying soil microbial communities, environmental factors, and denitrification rates are difficult to identify due to complex interactions between the environment and denitrifiers as well as the diversity of denitrifier genotypes and phenotypes. Using metagenomic analysis, this study provides an unbiased estimate of the relative abundance for all denitrification genes in a small headwater catchment with predominantly agricultural or forest land cover. This information was paired with 16S amplicon sequencing, environmental measurements, and denitrification end product measurements in order to elucidate the complex relationships mentioned above. Distinct patterns of denitrification gene abundance were observed at the landscape scale. One subset of denitrification genes, nirS, nosZ, and cNor, were found to co-occur at sites with environmental conditions most favorable for denitrification, indicating that specialized denitrifying communities exist at these sites. Moreover, the genes nirK and qNor were found to show a negative correlation with the previously mentioned gene subset. Soils with higher levels of nirS, nosZ, and cNor were observed to have higher denitrification process rates. This work demonstrates that the information gained from analysis of denitrifier communities via metagenomics can provide unique insights that can help identify denitrification hotspots at the landscape scale.","{""ENA-FIRST-PUBLIC"": ""2018-09-05"", ""ENA-LAST-UPDATE"": ""2018-08-31""}",ERP110651,,"Metagenomic analysis reveals distinct patterns of denitrification gene abundance across soil moisture, nitrate gradients",Other,,ERA1584502,,,,,soil metagenome,,2247936194.0,/dataset/5573882
83,,,,100.0,534094207,566254761.0,565081365,4976,533699918.0,,PRJEB12327,SAMEA3723388,https://www.ncbi.nlm.nih.gov/biosample/4552122,Generic,Generic.1.0,4552122.0,2013-09-10,,"Fri, 11 Aug 2017 08:25:55 -0000",SRA,2327130,0,,910011908.0,5020,glacier,alpine glacier,cryoconite,sediment,,,,ERX1273403,https://www.ncbi.nlm.nih.gov/sra/2327130,Illumina HiSeq 1500 paired end sequencing,,0.0,Pakistan,,2604233.0,Illumina HiSeq 1500,metagenome,,,35.68700,paired,,,10917824.0,size fractionation,metagenomic,WGS,76.64640,35.687,76.6464,"Fri, 21 Oct 2016 00:00:00 -0000",sediment,metagenome,1.0,MIMS,1.0,illumina,408169.0,,1.0,,,UNIMIB,,Ecosystem functions in cryoconite,,,ERR1201181,,"{""env_feature"": ""alpine glacier"", ""project_name"": ""Ecosystem functions in cryoconite"", ""geographic location (country and/or sea)"": ""Pakistan"", ""collection_date"": ""2013-09-10"", ""env_biome"": ""glacier"", ""longitude"": ""76.64640"", ""env_material"": ""cryoconite"", ""sediment environmental package"": ""sediment"", ""depth"": ""0"", ""sequencing method"": ""Illumina HiSeq"", ""sample_name"": ""ERS1030537"", ""latitude"": ""35.68700"", ""investigation_type"": ""metagenome"", ""geographic location (elevation)"": ""5020""}",,ERS1030537,Kar-23; Cryoconite,,Illumina HiSeq,,,"Biological processes on glacier surfaces affect glacier reflectance, influence surface energy budget and glacier response to climate warming, and determine glacier carbon exchange with the atmosphere. Currently, carbon balance of supraglacial environment is assessed as the balance between the activity of oxygenic phototrophs and the respiration rate of heterotrophic organisms. Here we present a metagenomic analysis of tiny wind-blown supraglacial sediment (cryoconite) from Baltoro (Pakistani Karakoram) and Forni (Italian Alps) glaciers providing evidence for the occurrence in these environments of different and previously neglected metabolic pathways. Indeed, we observed high abundance of heterotrophic anoxygenic phototrophs, suggesting that light might directly supplement the energy demand of some bacterial strains allowing them to use as carbon source organic molecules which otherwise would be respired. Furthermore, data suggest that CO2 could be produced also by microbiologically mediated oxidation of CO, which is produced in snow by photodegradation of organic matter.",,ERP013793,,Light-dependent microbial metabolisms drive carbon fluxes on glacier surfaces,Other,,ERA551821,,,,,metagenomes,,2199135227.0,/dataset/2604233
84,,,,150.0,1376024488,1630443941.0,1627151371,621912,1369665488.0,,PRJEB18470,SAMEA19305418,https://www.ncbi.nlm.nih.gov/biosample/8125884,Generic,Generic.1.0,8125884.0,2016-04,,"Thu, 09 May 2019 15:05:46 -0000",SRA,4795898,,,2325967813.0,,,,,wastewater/sludge,,,,ERX1815500,https://www.ncbi.nlm.nih.gov/sra/4795898,Illumina HiSeq 2000 paired end sequencing,,0.0,China,,5121529.0,Illumina HiSeq 2000,metagenome,,,116.3,paired,,,20013024.0,RANDOM,metagenomic,WGS,39.9,,39.9,"Sun, 03 Dec 2017 00:00:00 -0000",wastewater/sludge,metagenome,1.0,MIMS,1.0,illumina,256318.0,,1.0,,,"RESEARCH CENTER FOR ECO-ENVIRONMENTAL SCIENCES, CHINESE ACADEMY OF SCIENCES",,resistome of anaerobic sludge,,,ERR1746303,,"{""INSDC last update"": ""2016-12-04T16:10:45Z"", ""project_name"": ""resistome of anaerobic sludge"", ""wastewater/sludge environmental package"": ""wastewater/sludge"", ""description"": ""anaerobic sludge"", ""Title"": ""UASB-D30"", ""collection_date"": ""2016-04"", ""SRA accession"": ""ERS1463855"", ""sample_name"": ""ERS1463855"", ""geographic location (latitude)"": ""116.3"", ""INSDC center alias"": ""RESEARCH CENTER FOR ECO-ENVIRONMENTAL SCIENCES, CHINESE ACADEMY OF SCIENCES"", ""Alias"": ""D30"", ""INSDC status"": ""public"", ""sequencing method"": ""Illumina Hiseq"", ""geo_loc_name"": ""China"", ""ENA checklist"": ""ERC000023"", ""INSDC center name"": ""RESEARCH CENTER FOR ECO-ENVIRONMENTAL SCIENCES, CHINESE ACADEMY OF SCIENCES"", ""investigation_type"": ""metagenome"", ""INSDC first public"": ""2017-12-03T17:02:32Z"", ""geographic location (longitude)"": ""39.9""}",,ERS1463855,D30,,Illumina Hiseq,,,"The presence of high concentration antibiotics in wastewater can disturb the stability of biological wastewater treatment systems and promote generation of antibiotic resistance genes (ARGs) during the treatment. To solve this problem, a pilot system consisting of enhanced hydrolysis pretreatment and an up-flow anaerobic sludge bed (UASB) reactor in succession was constructed for treating oxytetracycline production wastewater, and the performance was evaluated in a pharmaceutical factory in comparison with a full-scale anaerobic system operated in parallel. After enhanced hydrolysis under conditions of pH 7 and 85 oC for 6 h, oxytetracycline production wastewater with an influent chemical oxygen demand (COD) of 11,086 ± 602 mg L-1 was directly introduced into the pilot UASB reactor. With the effective removal of oxytetracycline and its antibacterial activity (from 874 and 900 mg L-1 to less than 0.61 and 0.84 mg L-1, respectively) by the enhanced hydrolysis pretreatment, a COD removal between 68.9 % and 83.2 % was achieved at an organic loading rate ranging from 3.3 to 5.9 kg m-3 d-1. At the same time, the relative abundances of the total tet genes and a mobile element (Class 1 integron) in anaerobic sludge on Day 96 were one order of magnitude lower than those inoculated on Day 0 (P< 0.01). The reduction of ARGs was further demonstrated by metagenomic sequencing. By comparison, the full-scale anaerobic system treating oxytetracycline production wastewater with an influent COD of 3,720 ± 128 mg L-1 after dilution exhibited a COD removal of 51 ± 4 % at an OLR 1.2 ± 0.2 kg m-3 d-1, and a total tet gene abundance in sludge was five times higher than the pilot-scale system (P< 0.01). The above result demonstrated that enhanced hydrolysis as a pretreatment method could enable efficient anaerobic treatment of oxytetracycline production wastewater containing high concentrations of oxytetracycline with significantly lower generation of ARGs.","{""ENA-FIRST-PUBLIC"": ""2017-12-03"", ""ENA-LAST-UPDATE"": ""2016-12-04""}",ERP020400,,Anaerobic Treatment of Antibiotic Production Wastewater Pretreated with Enhanced Hydrolysis: Simultaneous Reduction of COD and ARGs,Other,,ERA771265,,,,,metagenome,,6003907200.0,/dataset/5121529
85,,,,101.0,992192326,1755376004.0,1751547571,16501965,1002852656.0,,PRJNA254830,SAMN02905599,https://www.ncbi.nlm.nih.gov/biosample/2905599,"MIMS.me, MIGS/MIMS/MIMARKS.plant-associated",MIMS.me.plant-associated.4.0,2905599.0,20-Nov-12,,"Thu, 10 Aug 2017 17:53:48 -0000",SRA,907462,,,3802052161.0,,Subtropical Division - Mountain Provinces (M230),botanical garden,soil,,,,COMT-Knockdown Switchgrass Rhizosphere                 Metagenome,SRX648996,https://www.ncbi.nlm.nih.gov/sra/907462,plot19B metagenome,,0.0,"USA: Knoxville, TN",,2530904.0,Illumina HiSeq 2000,,,35.904411 N 83.953801 E,,paired,,,27319161.0,,metagenomic,WGS,,35.9044,83.9538,"Tue, 22 Jul 2014 06:51:34 -0000",plant-associated,metagenome,1.0,MIMS,1.0,illumina,1297885.0,,1.0,,"Archana Chauhan, achauha1@utk.edu",The University of Tennessee,,,,,SRR1511001,,"{""env_feature"": ""botanical garden"", ""plot"": ""plot_19"", ""collection_date"": ""20-Nov-12"", ""env_biome"": ""Subtropical Division - Mountain Provinces (M230)"", ""env_material"": ""soil"", ""host"": ""Switchgrass"", ""geo_loc_name"": ""USA: Knoxville, TN"", ""lat_lon"": ""35.904411 N 83.953801 E""}",Keywords: GSC:MIxS;MIMS:4.0,SRS656252,MIMS Environmental/Metagenome sample from plant metagenome,,illumina,,Switchgrass,The project was designed to the impact of genetically engineered switchgrass on the microbial population and major bio-geochemical cycles,,SRP044193,,COMT Switchgrass Root Associated Metagenome and Metatranscriptome,Metagenomics,,SRA174711,,,,,plant metagenome,,5518470522.0,/dataset/2530904
